id,created_utc,title,selftext,full_link
v082mo,1653818697,Free kids' activities in Singapore for June school holidays,,https://www.reddit.com/r/singapore/comments/v082mo/free_kids_activities_in_singapore_for_june_school/
v07tee,1653817565,It’s been a month after the covid transition. How’s everyone doing?,[removed],https://www.reddit.com/r/singapore/comments/v07tee/its_been_a_month_after_the_covid_transition_hows/
v07qbg,1653817154,Where is everyone?,[removed],https://www.reddit.com/r/singapore/comments/v07qbg/where_is_everyone/
v07d6i,1653815446,Chess: Tin Jingyao set to become Singapore's youngest Grandmaster at 21,,https://www.reddit.com/r/singapore/comments/v07d6i/chess_tin_jingyao_set_to_become_singapores/
v07coa,1653815382,Any Singaporeans living in London/travelled to London recently?,[removed],https://www.reddit.com/r/singapore/comments/v07coa/any_singaporeans_living_in_londontravelled_to/
v069b7,1653810206,Winter Clothes in Singapore,[removed],https://www.reddit.com/r/singapore/comments/v069b7/winter_clothes_in_singapore/
v06661,1653809772,Enjoying fish under the sun,,https://www.reddit.com/r/singapore/comments/v06661/enjoying_fish_under_the_sun/
v0661g,1653809755,Handmade Polish pierogis by a Singaporean chef? It’s all thanks to a family recipe,,https://www.reddit.com/r/singapore/comments/v0661g/handmade_polish_pierogis_by_a_singaporean_chef/
v062zu,1653809365,"NUS, NTU grads can go job hunting in Britain under new visa scheme",,https://www.reddit.com/r/singapore/comments/v062zu/nus_ntu_grads_can_go_job_hunting_in_britain_under/
v05uld,1653808272,Gen Y Speaks: Leaving Singapore and my parents’ loving arms taught me how to adult,,https://www.reddit.com/r/singapore/comments/v05uld/gen_y_speaks_leaving_singapore_and_my_parents/
