id,submission_id,body,created_utc,parent_id,permalink
ianm23y,v1b0n2,u now cosplaying as guy or girl,1654000348,t1_iangx2k,/r/singapore/comments/v1b0n2/rsingapore_random_discussion_and_small_questions/ianm23y/
ianr80i,v1b0n2,missy say this one cannot be treated alr,1654003144,t1_iangx2k,/r/singapore/comments/v1b0n2/rsingapore_random_discussion_and_small_questions/ianr80i/
ianidqo,v1b0n2,Cosplay as?,1653998134,t1_iangx2k,/r/singapore/comments/v1b0n2/rsingapore_random_discussion_and_small_questions/ianidqo/
iani984,v1b0n2,Yelan cosplay?,1653998054,t1_iangx2k,/r/singapore/comments/v1b0n2/rsingapore_random_discussion_and_small_questions/iani984/
ianif4g,v1b0n2,Kinnikuman?,1653998159,t1_iangx2k,/r/singapore/comments/v1b0n2/rsingapore_random_discussion_and_small_questions/ianif4g/
ialr420,v1b0n2,"If that's the duration stated in your contract, then that's his problem, not yours.",1653955147,t1_ialqxrn,/r/singapore/comments/v1b0n2/rsingapore_random_discussion_and_small_questions/ialr420/
ialss3s,v1b0n2,Wads the duration in yr contract?,1653956017,t1_ialqxrn,/r/singapore/comments/v1b0n2/rsingapore_random_discussion_and_small_questions/ialss3s/
iam5rnq,v1b0n2,When u starting ur new job?\n\nWork until then or give yourself one week break,1653962652,t1_ialqxrn,/r/singapore/comments/v1b0n2/rsingapore_random_discussion_and_small_questions/iam5rnq/
ian1fs0,v1b0n2,Fish soup?,1653984273,t1_iamjxjn,/r/singapore/comments/v1b0n2/rsingapore_random_discussion_and_small_questions/ian1fs0/
ian0kzx,v1b0n2,"> which knows my name \n\nthat's new, usually is just ""Hello Ministry of Health blahblabhblah""",1653983499,t1_ian07rb,/r/singapore/comments/v1b0n2/rsingapore_random_discussion_and_small_questions/ian0kzx/
ian95qu,v1b0n2,Done by a foot masseur/masseuse? Shouldn't cause any bruising.,1653991295,t1_ian4lg0,/r/singapore/comments/v1b0n2/rsingapore_random_discussion_and_small_questions/ian95qu/
ianhpqa,v1b0n2,Totally not normal !!,1653997710,t1_ian4lg0,/r/singapore/comments/v1b0n2/rsingapore_random_discussion_and_small_questions/ianhpqa/
ianesb4,v1b0n2,Vendor life sad life bruh,1653995730,t1_iancbru,/r/singapore/comments/v1b0n2/rsingapore_random_discussion_and_small_questions/ianesb4/
iang8x2,v1b0n2,I miss boost!! 😭,1653996740,t1_ianfzyk,/r/singapore/comments/v1b0n2/rsingapore_random_discussion_and_small_questions/iang8x2/
iaoe570,v1b0n2,Ministers and mayors: “work? Simi Lai eh?”,1654013497,t1_iao0bmh,/r/singapore/comments/v1b0n2/rsingapore_random_discussion_and_small_questions/iaoe570/
iao6l2g,v1b0n2,by observing your surrounding first i think and learn empathy?,1654010268,t1_iao5r5q,/r/singapore/comments/v1b0n2/rsingapore_random_discussion_and_small_questions/iao6l2g/
iaob1xv,v1b0n2,You know how you get better at gaming by watching replays. Replay the scenarios in your head and try to think of ways to be better.,1654012180,t1_iao5r5q,/r/singapore/comments/v1b0n2/rsingapore_random_discussion_and_small_questions/iaob1xv/
iaoctd9,v1b0n2,"hmm i would say really slow down to think about the POV of the people you are interacting with, instead of what you know/your own opinions",1654012925,t1_iao5r5q,/r/singapore/comments/v1b0n2/rsingapore_random_discussion_and_small_questions/iaoctd9/
iao65s9,v1b0n2,By lowering his/her IQ,1654010082,t1_iao5r5q,/r/singapore/comments/v1b0n2/rsingapore_random_discussion_and_small_questions/iao65s9/
ianod5o,v1b0n2,Good sleep is one less thing to worry about!,1654001628,t1_ianlpa8,/r/singapore/comments/v1b0n2/rsingapore_random_discussion_and_small_questions/ianod5o/
ian6w5i,v1b0n2,thank you uwu i think i caught u staring,1653989291,t1_ian56cc,/r/singapore/comments/v1b0n2/rsingapore_random_discussion_and_small_questions/ian6w5i/
ian8k9c,v1b0n2,"Aiya you go out there work for 2 years become normie already la, don't need to worry",1653990780,t1_ian8ek2,/r/singapore/comments/v1b0n2/rsingapore_random_discussion_and_small_questions/ian8k9c/
ian8u7a,v1b0n2,u r my king,1653991020,t1_ian8ek2,/r/singapore/comments/v1b0n2/rsingapore_random_discussion_and_small_questions/ian8u7a/
ianthq4,v1b0n2,wow big eater leh.,1654004284,t1_ianrr1d,/r/singapore/comments/v1b0n2/rsingapore_random_discussion_and_small_questions/ianthq4/
iao3sli,v1b0n2,"frozen chicken plenty, not fresh chicken",1654009052,t1_ianrr1d,/r/singapore/comments/v1b0n2/rsingapore_random_discussion_and_small_questions/iao3sli/
iaoksbr,v1b0n2,"generally, GPs have some anxiety pills, but I don't know if they are able to prescribe you (its more for emergency uses). Seeing a psychologist would be better.\n\nAlternatively, maybe get the pills for motion sickness? I don't know if it helps for you, but it makes me sleepy and I sleep for the whole flight.",1654016296,t1_ianysg1,/r/singapore/comments/v1b0n2/rsingapore_random_discussion_and_small_questions/iaoksbr/
iaoofpd,v1b0n2,"hi i feel u i used to struggle with this too when i was younger! i would eat drowsy medicine/ muscle relaxant before i board haha but i also saw a psychiatrist who taught me some ways of relaxing/ helped me work through understanding my anxieties e.g for me one major contributing factor was the smell of the plane > gagging > vomiting throughout which leads to fear and vicious cycle. so back then i wore masks sprayed and soaked in my moms perfume + ate anti nausea medicine to prep beforehand etc.. prepping also starts a few days before, mental preparation, coming up with a list of things that might calm u down (whether music, or downloading shows to watch while waiting, or comfy clothes etc). sorry fr the long wall of text haha but i hope things go well for u!!",1654017820,t1_ianysg1,/r/singapore/comments/v1b0n2/rsingapore_random_discussion_and_small_questions/iaoofpd/
iamctwn,v1b0n2,i sat here for a good 10s wondering what HMM stood for until i realised it's just hmm,1653966390,t1_iamaipz,/r/singapore/comments/v1b0n2/rsingapore_random_discussion_and_small_questions/iamctwn/
iamdxt6,v1b0n2,Is the 1st temp job something you wanna do? Does it add value to your life in any way? \n\nCongrats on getting interviews btw!,1653967019,t1_iamaipz,/r/singapore/comments/v1b0n2/rsingapore_random_discussion_and_small_questions/iamdxt6/
ian1f4w,v1b0n2,Being called for a 2nd interview is definitely better news than not being called at all lol.,1653984256,t1_ian0532,/r/singapore/comments/v1b0n2/rsingapore_random_discussion_and_small_questions/ian1f4w/
ian4yj5,v1b0n2,"Being called for 2nd interview is definitely good news.\n\nUhhh knowing HR from govt stat boars, don't hold your breath. They're damn slow unless the hiring manager is really desperate and keep poking them to expedite",1653987506,t1_ian0532,/r/singapore/comments/v1b0n2/rsingapore_random_discussion_and_small_questions/ian4yj5/
iangcu4,v1b0n2,Is ok bro less than 5 hrs to start a new day liao,1653996812,t1_ianemqn,/r/singapore/comments/v1b0n2/rsingapore_random_discussion_and_small_questions/iangcu4/
ianfirj,v1b0n2,hope you get to pangsai,1653996242,t1_ianemqn,/r/singapore/comments/v1b0n2/rsingapore_random_discussion_and_small_questions/ianfirj/
iannvtn,v1b0n2,u/onlysyns,1654001364,t1_ianne4n,/r/singapore/comments/v1b0n2/rsingapore_random_discussion_and_small_questions/iannvtn/
ianxicl,v1b0n2,"Insurance agents no. Those in the same profession, maybe yes.",1654006205,t1_ianu52d,/r/singapore/comments/v1b0n2/rsingapore_random_discussion_and_small_questions/ianxicl/
iao4knu,v1b0n2,Put them in cold storage,1654009389,t1_ianu52d,/r/singapore/comments/v1b0n2/rsingapore_random_discussion_and_small_questions/iao4knu/
ianv68u,v1b0n2,"Yes, cos why not? U have to pay LinkedIn to view search results profile of people outside 3rd line of connection.",1654005098,t1_ianu52d,/r/singapore/comments/v1b0n2/rsingapore_random_discussion_and_small_questions/ianv68u/
iao8pgg,v1b0n2,"No context leh. If food didn't arrive after an hour, I'd let the person let off steam too.",1654011178,t1_iao5lzp,/r/singapore/comments/v1b0n2/rsingapore_random_discussion_and_small_questions/iao8pgg/
iaod3el,v1b0n2,Probably call him a dickhead,1654013045,t1_iao5lzp,/r/singapore/comments/v1b0n2/rsingapore_random_discussion_and_small_questions/iaod3el/
iao68ow,v1b0n2,Reply:\n\nDon't mind if I do.,1654010117,t1_iao5lzp,/r/singapore/comments/v1b0n2/rsingapore_random_discussion_and_small_questions/iao68ow/
iao8qwb,v1b0n2,Secretly judge him but don't tell him.,1654011195,t1_iao5lzp,/r/singapore/comments/v1b0n2/rsingapore_random_discussion_and_small_questions/iao8qwb/
iaocjgs,v1b0n2,"for that amount of money, you can see a licensed therapist for much cheaper lol.. also see the google 1 star reviews, looks so dodgy",1654012810,t1_iao9ybf,/r/singapore/comments/v1b0n2/rsingapore_random_discussion_and_small_questions/iaocjgs/
iamagnn,v1b0n2,What other vaccines are there ah? I only took tetanus shot recently but like not much side effects. Are you experiencing any side effects after covid-19 vaccine?,1653965104,t1_iama944,/r/singapore/comments/v1b0n2/rsingapore_random_discussion_and_small_questions/iamagnn/
ian5hlx,v1b0n2,"Took Twinrix (Hep A & B), apart from the needle being pretty big, no s/e or whatever. Moderna had more kick.",1653987986,t1_iama944,/r/singapore/comments/v1b0n2/rsingapore_random_discussion_and_small_questions/ian5hlx/
iamg6eu,v1b0n2,Dumplings,1653968335,t1_iamayxr,/r/singapore/comments/v1b0n2/rsingapore_random_discussion_and_small_questions/iamg6eu/
iamb4kh,v1b0n2,Yong tau foo!,1653965455,t1_iamayxr,/r/singapore/comments/v1b0n2/rsingapore_random_discussion_and_small_questions/iamb4kh/
iampkdu,v1b0n2,Whopper jr,1653974511,t1_iamayxr,/r/singapore/comments/v1b0n2/rsingapore_random_discussion_and_small_questions/iampkdu/
iamh9n3,v1b0n2,>Going to the East Coast in September for 2 weeks.\n\nWtf u doing at East Coast Park for 2 weeks\n\n>US\n\nOhhh,1653968996,t1_iamdmdd,/r/singapore/comments/v1b0n2/rsingapore_random_discussion_and_small_questions/iamh9n3/
iames6u,v1b0n2,"Premium outlet: you may get quite a bargain for coach, Kate spade, tommy, Ralph Lauren, Nike, Calvin Klein etc.\n\nYes clothes definitely cheaper, especially male clothes.",1653967508,t1_iamdmdd,/r/singapore/comments/v1b0n2/rsingapore_random_discussion_and_small_questions/iames6u/
iamfn30,v1b0n2,Online quite cheap esp departmental stores like macys belk etc. if u got an address to ship to.,1653968014,t1_iamdmdd,/r/singapore/comments/v1b0n2/rsingapore_random_discussion_and_small_questions/iamfn30/
iamgah2,v1b0n2,"definitely way cheaper. take your time at the designer outlets; when i was there for 3 weeks a few years back i bought enough clothes to replace my entire wardrobe, including underwear. if you like to wear comfy atas underwear, it's your chance to stock up",1653968404,t1_iamdmdd,/r/singapore/comments/v1b0n2/rsingapore_random_discussion_and_small_questions/iamgah2/
iamlbig,v1b0n2,Borrow from library (physical or ebook)?\n\nAt least that's my current plan to save money. If available at library I'll borrow. Buy only if I'll reference it a lot or want it urgently.,1653971603,t1_iamgf7n,/r/singapore/comments/v1b0n2/rsingapore_random_discussion_and_small_questions/iamlbig/
iamgwrs,v1b0n2,I've bought twice and its been hit and miss. Both had lots of reviews and pictures of product but 1 was shit quality and print I didnt even bother reading and just threw it away (it was the cheapest listing) and another was decent (not the cheapest listing) just paper quality soso only.,1653968777,t1_iamgf7n,/r/singapore/comments/v1b0n2/rsingapore_random_discussion_and_small_questions/iamgwrs/
iamke1z,v1b0n2,"SG is where those 30 – 50 y/o guys either watch Channel 8, Toggle or iQiYi, Netflix all that is younger gen ah.",1653970980,t1_iamk5v3,/r/singapore/comments/v1b0n2/rsingapore_random_discussion_and_small_questions/iamke1z/
iammke6,v1b0n2,I don't watch Breaking Bad now certainly. I watched it a long time ago though. It's a masterpiece in television storytelling. And Brian Cranston is such a damn good actor.,1653972434,t1_iamk5v3,/r/singapore/comments/v1b0n2/rsingapore_random_discussion_and_small_questions/iammke6/
iamn5b6,v1b0n2,"Several of my friends who are in that age range does watch the show. \n\nFor BCS, I think the determining factor is whether the person watched BB. If they never watched Breaking Bad previously, it is less likely that they will watch BCS as a standalone series.\n\nAnd like BB, BCS first few seasons is dead slow. You really need the patience and belief to see it through to the subsequent seasons where it gets better.",1653972828,t1_iamk5v3,/r/singapore/comments/v1b0n2/rsingapore_random_discussion_and_small_questions/iamn5b6/
iamp2yt,v1b0n2,"I watched both. The problem is because Breaking Bad started 14 years ago, it's considered (old) since there's so much more content out there. \n\nFor BCS, it's a really really, really, slow burn. But it's a great show nonetheless. I had my doubts on how a prequel for BB actually worked, but I really like the way it's set up. Happy to discuss anything! (I've watched up to the mid-season finale of the final season of BCS)",1653974168,t1_iamk5v3,/r/singapore/comments/v1b0n2/rsingapore_random_discussion_and_small_questions/iamp2yt/
iamp289,v1b0n2,"Book, not a game?",1653974154,t1_iamnyzx,/r/singapore/comments/v1b0n2/rsingapore_random_discussion_and_small_questions/iamp289/
iamzgkk,v1b0n2,shower head ah? get those micro hole looking kind cheap cheap but damn shiok,1653982487,t1_iams2t8,/r/singapore/comments/v1b0n2/rsingapore_random_discussion_and_small_questions/iamzgkk/
ian5fyx,v1b0n2,"report police, get them to investigate and check cctv",1653987946,t1_iamvexl,/r/singapore/comments/v1b0n2/rsingapore_random_discussion_and_small_questions/ian5fyx/
iancxc4,v1b0n2,r&b has it i think,1653994364,t1_iamxrjx,/r/singapore/comments/v1b0n2/rsingapore_random_discussion_and_small_questions/iancxc4/
ian96fn,v1b0n2,Not going up if you have fixed rate for the next 2 years *taps on noggin*,1653991311,t1_ian850d,/r/singapore/comments/v1b0n2/rsingapore_random_discussion_and_small_questions/ian96fn/
ianalu7,v1b0n2,I have 5 year fixed rate bro.,1653992531,t1_ian850d,/r/singapore/comments/v1b0n2/rsingapore_random_discussion_and_small_questions/ianalu7/
ianc61e,v1b0n2,Honestly it's very easy to DIY. Can refer to YouTube if you need help. Use tape to align first!,1653993784,t1_ianbsjy,/r/singapore/comments/v1b0n2/rsingapore_random_discussion_and_small_questions/ianc61e/
iancg5b,v1b0n2,No.,1653994001,t1_ianbsjy,/r/singapore/comments/v1b0n2/rsingapore_random_discussion_and_small_questions/iancg5b/
iany09r,v1b0n2,Since you want beach. Why not langkawi or Bintan or taiwan? Or even Thailand,1654006438,t1_iandl61,/r/singapore/comments/v1b0n2/rsingapore_random_discussion_and_small_questions/iany09r/
ianjtol,v1b0n2,"Don't forget to consider the weather too, but i prefer Phuket even though it is may as hot as SG because it is cheaper and can stay at nice resort for relaxing and thai food rarely fails if it is not bland..",1653999020,t1_iandl61,/r/singapore/comments/v1b0n2/rsingapore_random_discussion_and_small_questions/ianjtol/
iangcqc,v1b0n2,"you dont need so long at phuket! melbourne is a better choice, have you considered bangkok instead?",1653996810,t1_iandl61,/r/singapore/comments/v1b0n2/rsingapore_random_discussion_and_small_questions/iangcqc/
iangtcz,v1b0n2,"What are you looking for on your trip? I've spent significantly longer in Phuket just chilling by the beaches, and I've spent that exact time in Melbourne as well. Both are great but offer different experiences.",1653997121,t1_iandl61,/r/singapore/comments/v1b0n2/rsingapore_random_discussion_and_small_questions/iangtcz/
ianehy5,v1b0n2,"Grabpet, iirc",1653995521,t1_iandyeb,/r/singapore/comments/v1b0n2/rsingapore_random_discussion_and_small_questions/ianehy5/
ianef2l,v1b0n2,Book the one can pet de,1653995464,t1_iandyeb,/r/singapore/comments/v1b0n2/rsingapore_random_discussion_and_small_questions/ianef2l/
ianp1y2,v1b0n2,Nope… nothing here … man 😞,1654001999,t1_ianh7e5,/r/singapore/comments/v1b0n2/rsingapore_random_discussion_and_small_questions/ianp1y2/
ianlgwm,v1b0n2,I just returned from Batam. \n\nNo need PCR or ART test. \n\nProcess a bit different. Now need to download and set up the PeduliLindungi app. That’s like Indonesia’s TT.,1654000000,t1_ianilsb,/r/singapore/comments/v1b0n2/rsingapore_random_discussion_and_small_questions/ianlgwm/
iao17zh,v1b0n2,"It means something like ""haven't wise up"". If you are doing something the wrong way (e.g. you are working hard instead of working smart), then someone may say that to you.",1654007912,t1_iao0iy9,/r/singapore/comments/v1b0n2/rsingapore_random_discussion_and_small_questions/iao17zh/
iao1mff,v1b0n2,"Means like you are not wise? Idk if I described it properly. \n\nEg: Ah Tan kena scammed by siam bu again, he really buay seng mok from previous lessons sia!",1654008087,t1_iao0iy9,/r/singapore/comments/v1b0n2/rsingapore_random_discussion_and_small_questions/iao1mff/
iao1ncc,v1b0n2,不醒目 if you know Chinese,1654008098,t1_iao0iy9,/r/singapore/comments/v1b0n2/rsingapore_random_discussion_and_small_questions/iao1ncc/
iao4c6u,v1b0n2,Not alert ba,1654009287,t1_iao0iy9,/r/singapore/comments/v1b0n2/rsingapore_random_discussion_and_small_questions/iao4c6u/
iao39sp,v1b0n2,[deleted],1654008820,t1_iao2zjj,/r/singapore/comments/v1b0n2/rsingapore_random_discussion_and_small_questions/iao39sp/
iapce27,v1b0n2,Terrible customer service.,1654028625,t1_iapawb6,/r/singapore/comments/v1b0n2/rsingapore_random_discussion_and_small_questions/iapce27/
iamwfxp,v1b0n2,Miss him just say hehe,1653979879,t1_iamt5ry,/r/singapore/comments/v1b0n2/rsingapore_random_discussion_and_small_questions/iamwfxp/
ian208s,v1b0n2,Maybe because you’re too noisy by contrast,1653984800,t1_iamt5ry,/r/singapore/comments/v1b0n2/rsingapore_random_discussion_and_small_questions/ian208s/
ialwtmy,v1b0n2,/u/hafchiu_pangsai,1653958079,t1_ialvmdt,/r/singapore/comments/v1b0n2/rsingapore_random_discussion_and_small_questions/ialwtmy/
iam3ml2,v1b0n2,in 5mins..post pics later.,1653961551,t1_ialvmdt,/r/singapore/comments/v1b0n2/rsingapore_random_discussion_and_small_questions/iam3ml2/
ialwxjx,v1b0n2,hehe,1653958134,t1_ialvmdt,/r/singapore/comments/v1b0n2/rsingapore_random_discussion_and_small_questions/ialwxjx/
ialycnv,v1b0n2,https://youtu.be/P_Dw1i_0e6A,1653958858,t1_ials7e1,/r/singapore/comments/v1b0n2/rsingapore_random_discussion_and_small_questions/ialycnv/
iamz8d5,v1b0n2,IA IA IA pull tilt check,1653982289,t1_iaml032,/r/singapore/comments/v1b0n2/rsingapore_random_discussion_and_small_questions/iamz8d5/
ian3bz5,v1b0n2,"You never not deserve a good bowl of maggi, and you can always burn it off another day! :D",1653986013,t1_iamur3s,/r/singapore/comments/v1b0n2/rsingapore_random_discussion_and_small_questions/ian3bz5/
ian84p1,v1b0n2,"yes, sit at the bigger food court",1653990398,t1_ian81sg,/r/singapore/comments/v1b0n2/rsingapore_random_discussion_and_small_questions/ian84p1/
iao5mwf,v1b0n2,honeycombers has a glasses recommends but keen to hear coz i need myself a pair too,1654009855,t1_ianz6og,/r/singapore/comments/v1b0n2/rsingapore_random_discussion_and_small_questions/iao5mwf/
iamokqn,v1b0n2,not asking for yourself?,1653973811,t1_iam6q7e,/r/singapore/comments/v1b0n2/rsingapore_random_discussion_and_small_questions/iamokqn/
iamczd5,v1b0n2,"Envy Cuts at Peninsula shopping centre, not a salon but theyll give you a solid cut",1653966473,t1_iam6q7e,/r/singapore/comments/v1b0n2/rsingapore_random_discussion_and_small_questions/iamczd5/
iamjk3i,v1b0n2,There are still definitely people driving manual cars here.,1653970443,t1_iamia5s,/r/singapore/comments/v1b0n2/rsingapore_random_discussion_and_small_questions/iamjk3i/
iamxhli,v1b0n2,Those typical modified cars you see around about half of them are manual probably. I used to own a manual car last year. Nowadays I'll rent a manual car once in a while because I'll miss the feeling.,1653980755,t1_iamia5s,/r/singapore/comments/v1b0n2/rsingapore_random_discussion_and_small_questions/iamxhli/
ianip9e,v1b0n2,me,1653998338,t1_iamia5s,/r/singapore/comments/v1b0n2/rsingapore_random_discussion_and_small_questions/ianip9e/
iam3igu,v1b0n2,I switched off my aircons and my nose allergy is gone,1653961494,t1_iam2v8u,/r/singapore/comments/v1b0n2/rsingapore_random_discussion_and_small_questions/iam3igu/
iam8jo3,v1b0n2,Sembawang Traditional Claypot Rice,1653964094,t1_iam4ycl,/r/singapore/comments/v1b0n2/rsingapore_random_discussion_and_small_questions/iam8jo3/
iam7z7g,v1b0n2,Dignity kitchen @ Boon Keng. Im not sure if it will fit your definition of “good” but I thought it was rather nice + you’re supporting a good cause.,1653963803,t1_iam4ycl,/r/singapore/comments/v1b0n2/rsingapore_random_discussion_and_small_questions/iam7z7g/
iamfkpw,v1b0n2,That's a dream all riders won't like it,1653967975,t1_iamco6s,/r/singapore/comments/v1b0n2/rsingapore_random_discussion_and_small_questions/iamfkpw/
iaml3wy,v1b0n2,"Unlikely. Fridge and medical equipment need it 247. Singapore will just buy at higher price and raise the electricity cost.\n\nAlso, we are not Texas.",1653971459,t1_iamhlw7,/r/singapore/comments/v1b0n2/rsingapore_random_discussion_and_small_questions/iaml3wy/
iamm3fb,v1b0n2,i'd still watch it... but yknow. prolly sailing the high seas for it.,1653972115,t1_iamktf4,/r/singapore/comments/v1b0n2/rsingapore_random_discussion_and_small_questions/iamm3fb/
iamqmh8,v1b0n2,do you have the spare links? the authorised distributor might be able to do it for you for free,1653975279,t1_iamqk86,/r/singapore/comments/v1b0n2/rsingapore_random_discussion_and_small_questions/iamqmh8/
iamurnd,v1b0n2,"Go check theshutterwhale IG, he is at bali now",1653978489,t1_iamup5o,/r/singapore/comments/v1b0n2/rsingapore_random_discussion_and_small_questions/iamurnd/
ianph2j,v1b0n2,"Iirc as long as it fits the provided clips I don't see why not, or if it's too big can always consider DIY using zip ties haha\n\nDun think need heat resistant ties right hmmm can't rmb",1654002222,t1_ianacwx,/r/singapore/comments/v1b0n2/rsingapore_random_discussion_and_small_questions/ianph2j/
ianntuv,v1b0n2,"yes because they need time to get to know who you are, my first 90 min session he only had a few comments and questions, perhaps more to the end, but 95% was me talking",1654001333,t1_ianllzv,/r/singapore/comments/v1b0n2/rsingapore_random_discussion_and_small_questions/ianntuv/
iaoeorv,v1b0n2,what happened to it,1654013729,t1_iaoed7h,/r/singapore/comments/v1b0n2/rsingapore_random_discussion_and_small_questions/iaoeorv/
iaoudwh,v1b0n2,"either take MC, do remote interviews/calls, or schedule interviews on lunch time/after working hours!",1654020305,t1_iaotqxp,/r/singapore/comments/v1b0n2/rsingapore_random_discussion_and_small_questions/iaoudwh/
iaplpvi,v1b0n2,+1 on taking MC,1654032706,t1_iaotqxp,/r/singapore/comments/v1b0n2/rsingapore_random_discussion_and_small_questions/iaplpvi/
iamahag,v1b0n2,Ohhhh the ban not started yet? Totally forgot.. no wonder why i still saw some jikens at supermarket yesterday,1653965113,t1_iam06av,/r/singapore/comments/v1b0n2/rsingapore_random_discussion_and_small_questions/iamahag/
iamal6u,v1b0n2,"No, a substantial proportion still use centralised exchanges including me. They have their uses. It doesn't make sense for everything to be decentralized since things would be chaotic without any governing body to organise",1653965171,t1_iam7ngz,/r/singapore/comments/v1b0n2/rsingapore_random_discussion_and_small_questions/iamal6u/
iamsge0,v1b0n2,you,1653976653,t1_iamrdqd,/r/singapore/comments/v1b0n2/rsingapore_random_discussion_and_small_questions/iamsge0/
ian3cvd,v1b0n2,Why damaged? :P,1653986036,t1_iamrdqd,/r/singapore/comments/v1b0n2/rsingapore_random_discussion_and_small_questions/ian3cvd/
iamr7eu,v1b0n2,I am kit,1653975705,t1_iamq5xl,/r/singapore/comments/v1b0n2/rsingapore_random_discussion_and_small_questions/iamr7eu/
iamtfhy,v1b0n2,meow,1653977406,t1_iamq5xl,/r/singapore/comments/v1b0n2/rsingapore_random_discussion_and_small_questions/iamtfhy/
iaokbnj,v1b0n2,they don't wish to talk to you anymore? :(,1654016102,t1_iaof2su,/r/singapore/comments/v1b0n2/rsingapore_random_discussion_and_small_questions/iaokbnj/
iam5mxk,v1b0n2,for classical can head down to library @esplanade. hopefully have the composer & the piece u want\n\nfor pop songs/modern music i donno.,1653962587,t1_iam4pph,/r/singapore/comments/v1b0n2/rsingapore_random_discussion_and_small_questions/iam5mxk/
iam9nja,v1b0n2,"You can try searching on musescore, but it might take a fair bit of trawling since it’s all based on user contributions. Some are WIPs, others are meh in terms of accuracy, and then there are the god-tier ones which are near-perfect.",1653964676,t1_iam4pph,/r/singapore/comments/v1b0n2/rsingapore_random_discussion_and_small_questions/iam9nja/
iamj47x,v1b0n2,"Both, I think. Permanent breakfast item.",1653970159,t1_iamg1wy,/r/singapore/comments/v1b0n2/rsingapore_random_discussion_and_small_questions/iamj47x/
iamgtij,v1b0n2,Breakfast only bro,1653968722,t1_iamg1wy,/r/singapore/comments/v1b0n2/rsingapore_random_discussion_and_small_questions/iamgtij/
iamgufo,v1b0n2,Bf,1653968739,t1_iamg1wy,/r/singapore/comments/v1b0n2/rsingapore_random_discussion_and_small_questions/iamgufo/
iamjur5,v1b0n2,It's breakfast and not all-day item,1653970639,t1_iamg1wy,/r/singapore/comments/v1b0n2/rsingapore_random_discussion_and_small_questions/iamjur5/
iamycqp,v1b0n2,you are not working for the same place in may already?,1653981515,t1_iamvrb7,/r/singapore/comments/v1b0n2/rsingapore_random_discussion_and_small_questions/iamycqp/
iamy2gt,v1b0n2,"Traditional car rental companies not possible. They'll 99% of the time only rent out for the whole weekend. For carsharing only Shariot allows it, but wether it's worth the price and hassle is up to you.",1653981263,t1_iamw9cm,/r/singapore/comments/v1b0n2/rsingapore_random_discussion_and_small_questions/iamy2gt/
