id,submission_id,body,created_utc,parent_id,permalink
ian0532,v1b0n2,"anyone has experience regarding stat boards, is being called for a 2nd interview a good sign? What's the typical timeline for them to get back to you after that?",1653983100,t3_v1b0n2,/r/singapore/comments/v1b0n2/rsingapore_random_discussion_and_small_questions/ian0532/
ianemqn,v1b0n2,Feeling like shit but wishing everyone to have a good day today,1653995619,t3_v1b0n2,/r/singapore/comments/v1b0n2/rsingapore_random_discussion_and_small_questions/ianemqn/
ianne4n,v1b0n2,[deleted],1654001093,t3_v1b0n2,/r/singapore/comments/v1b0n2/rsingapore_random_discussion_and_small_questions/ianne4n/
ianu52d,v1b0n2,How do you feel about those cold connections on Linkedin?  Do you accept?,1654004600,t3_v1b0n2,/r/singapore/comments/v1b0n2/rsingapore_random_discussion_and_small_questions/ianu52d/
iao5lzp,v1b0n2,How would you respond if your friend got pissed off by a service staff regarding something then he said ‘the service staff can go fuck themselves la’. \n\nNot in front of the staff face but only after he went off. But many ppl heard that… it wasn’t nice la tbh,1654009844,t3_v1b0n2,/r/singapore/comments/v1b0n2/rsingapore_random_discussion_and_small_questions/iao5lzp/
iao8eup,v1b0n2,https://www.youtube.com/watch?v=f69ghhwW1jA,1654011051,t3_v1b0n2,/r/singapore/comments/v1b0n2/rsingapore_random_discussion_and_small_questions/iao8eup/
iao9ybf,v1b0n2,Has anyone used stress.sg before? Is it worth the steep price of 3000 for 5 sessions?,1654011713,t3_v1b0n2,/r/singapore/comments/v1b0n2/rsingapore_random_discussion_and_small_questions/iao9ybf/
ialsngj,v1b0n2,ERP at KPE already operating? It's still before 830am 🤔,1653955950,t3_v1b0n2,/r/singapore/comments/v1b0n2/rsingapore_random_discussion_and_small_questions/ialsngj/
iama944,v1b0n2,"Has anyone taken other kind of vaccine, other than flu shot, in adult time? Were the side effects like covid-19 one?",1653964993,t3_v1b0n2,/r/singapore/comments/v1b0n2/rsingapore_random_discussion_and_small_questions/iama944/
iamayxr,v1b0n2,What’s for lunch!,1653965373,t3_v1b0n2,/r/singapore/comments/v1b0n2/rsingapore_random_discussion_and_small_questions/iamayxr/
iambiv4,v1b0n2,"If I have a family member applying bursary, do I need mine too if my parents' company letter is submitted?\n\nMy bro needs to apply for it btw",1653965672,t3_v1b0n2,/r/singapore/comments/v1b0n2/rsingapore_random_discussion_and_small_questions/iambiv4/
iamdmdd,v1b0n2,"Going to the East Coast in September for 2 weeks. Are luxury goods cheaper in the US than Singapore? Saw that there’s a huge designer outlet in Philly. Are clothes (Tommy, Ralph Lauren etc) also cheaper there?",1653966839,t3_v1b0n2,/r/singapore/comments/v1b0n2/rsingapore_random_discussion_and_small_questions/iamdmdd/
iamgf7n,v1b0n2,Anyone here have bought those cheap books on Shopee (reprints of books that are usually shipped out of Indonesia and costs a fraction of the real ones) ?  Am considering buying some self-help books for reading and is considering buying them as a budget-friendly alternative,1653968480,t3_v1b0n2,/r/singapore/comments/v1b0n2/rsingapore_random_discussion_and_small_questions/iamgf7n/
iamk5v3,v1b0n2,"Breaking Bad and Better Call Saul are not popular in Sg are they?\nI dont know many, or even any people in my circle (mid 30s to 50s) who watches them, which is a shame for an excellent series.",1653970836,t3_v1b0n2,/r/singapore/comments/v1b0n2/rsingapore_random_discussion_and_small_questions/iamk5v3/
iamnyzx,v1b0n2,"Looing for a book that has the main character(?) scream ""Lupercal"" as a war cry -- likely a fantasy/mythology book-  can' remember what exactly..",1653973393,t3_v1b0n2,/r/singapore/comments/v1b0n2/rsingapore_random_discussion_and_small_questions/iamnyzx/
iams2t8,v1b0n2,Anybody bought those shower set from shopee before? Wonder if there is a big difference between those and the” branded” ones?,1653976364,t3_v1b0n2,/r/singapore/comments/v1b0n2/rsingapore_random_discussion_and_small_questions/iams2t8/
iamvexl,v1b0n2,"wth parents car kena hit while parked, license plate bent, on floor, frame also kena rekt. heng the car itself seems to be unhit. person hit and run, nvr leave number.",1653979021,t3_v1b0n2,/r/singapore/comments/v1b0n2/rsingapore_random_discussion_and_small_questions/iamvexl/
iamxrjx,v1b0n2,Wish there was pineapple bubble tea flavour.,1653980996,t3_v1b0n2,/r/singapore/comments/v1b0n2/rsingapore_random_discussion_and_small_questions/iamxrjx/
iamyps3,v1b0n2,Is it safe to retake my booster shot in SG if I have already taken it overseas in January to avoid the hassle and cost of having the overseas record ingested to local database?,1653981828,t3_v1b0n2,/r/singapore/comments/v1b0n2/rsingapore_random_discussion_and_small_questions/iamyps3/
ian850d,v1b0n2,Wonder how much property loan interest rates are gonna go up in the next two years. Any guesses?,1653990406,t3_v1b0n2,/r/singapore/comments/v1b0n2/rsingapore_random_discussion_and_small_questions/ian850d/
ianbsjy,v1b0n2,Screen protector for my new phone arriving soon via delivery! \n\nIs it worth it to go to a phone shop to get professional help applying the screen protector? Any recommended shops for that? And roughly how much would that cost? Thanks! :)\n\nFyi I only got 1 piece so cannot screw up,1653993487,t3_v1b0n2,/r/singapore/comments/v1b0n2/rsingapore_random_discussion_and_small_questions/ianbsjy/
iandl61,v1b0n2,"For solo trip about 6d5n or 5d4n, which cities should I choose? Phuket or Melbourne? Not sure whether Melbourne is enough for travel within a week since it is much bigger than Phuket.",1653994856,t3_v1b0n2,/r/singapore/comments/v1b0n2/rsingapore_random_discussion_and_small_questions/iandl61/
iandyeb,v1b0n2,Does grab accept dogs in the ride?,1653995124,t3_v1b0n2,/r/singapore/comments/v1b0n2/rsingapore_random_discussion_and_small_questions/iandyeb/
ianfp9h,v1b0n2,smell of rain..,1653996365,t3_v1b0n2,/r/singapore/comments/v1b0n2/rsingapore_random_discussion_and_small_questions/ianfp9h/
ianh7e5,v1b0n2,Northeast raining? I hear thunder,1653997374,t3_v1b0n2,/r/singapore/comments/v1b0n2/rsingapore_random_discussion_and_small_questions/ianh7e5/
ianilsb,v1b0n2,Those that went to batam/bintan recently do they all require PCR/ART test? Is the process same as pre-covid?,1653998277,t3_v1b0n2,/r/singapore/comments/v1b0n2/rsingapore_random_discussion_and_small_questions/ianilsb/
ianyjum,v1b0n2,alamak damn hot tonight. im sweating while sitting down and doing nth.,1654006694,t3_v1b0n2,/r/singapore/comments/v1b0n2/rsingapore_random_discussion_and_small_questions/ianyjum/
ianyrcp,v1b0n2,Supposed to go office tomorrow but ended up not being able to because I took a nap after work and now foresee my body clock being screwed lol,1654006792,t3_v1b0n2,/r/singapore/comments/v1b0n2/rsingapore_random_discussion_and_small_questions/ianyrcp/
iao0iy9,v1b0n2,Anyone know the meaning of this hokkien phrase “buay seng mong” not sure if I spell it correctly,1654007597,t3_v1b0n2,/r/singapore/comments/v1b0n2/rsingapore_random_discussion_and_small_questions/iao0iy9/
iao2zjj,v1b0n2,If I am covid+ do you think I should do tele-consult to get my status recorded with MOH? Is there still any usefulness to that?,1654008693,t3_v1b0n2,/r/singapore/comments/v1b0n2/rsingapore_random_discussion_and_small_questions/iao2zjj/
iao5hnm,v1b0n2,can i honestly ask the christian friends...where are all the good churches? those that quietly exist in the community doing the good work? those that rationally balance their faith with the nuances of living in a multi religious Singapore,1654009790,t3_v1b0n2,/r/singapore/comments/v1b0n2/rsingapore_random_discussion_and_small_questions/iao5hnm/
iao800z,v1b0n2,For universal studios is it better to buy the ticket online first? There doesn't seem to be the option to buy it online without weird add-ons 🤔,1654010874,t3_v1b0n2,/r/singapore/comments/v1b0n2/rsingapore_random_discussion_and_small_questions/iao800z/
iao921h,v1b0n2,"Lmao less than one week after Japan start their trial for packaged tours already got ppl kenna covid. Whole tour cancelled, damn suay for everyone involved",1654011327,t3_v1b0n2,/r/singapore/comments/v1b0n2/rsingapore_random_discussion_and_small_questions/iao921h/
iaohwcu,v1b0n2,Does anyone use an Amaze card? I've been stuck trying to figure out whether using an Amaze card allows me to collect miles on my UOB Krisflyer card if i'm paying for rental/uni fees (which are normally excluded from the UOB Krisflyer card).,1654015086,t3_v1b0n2,/r/singapore/comments/v1b0n2/rsingapore_random_discussion_and_small_questions/iaohwcu/
iapawb6,v1b0n2,"There was a bicycle shop who was asked on Facebook chat by a potential customer if the decals on one of their bicycles can be peeled off. They replied ""Can your dick skin be peeled off? If yes then the decals can also be peeled off.""\n\nIs this an example of poor customer service? They clarified that they responded rudely because in bicycle culture the decals are considered a big deal.",1654027993,t3_v1b0n2,/r/singapore/comments/v1b0n2/rsingapore_random_discussion_and_small_questions/iapawb6/
iamt5ry,v1b0n2,some bi boi is awfully quiet today,1653977193,t3_v1b0n2,/r/singapore/comments/v1b0n2/rsingapore_random_discussion_and_small_questions/iamt5ry/
ialvmdt,v1b0n2,haf chiu pang sai?,1653957468,t3_v1b0n2,/r/singapore/comments/v1b0n2/rsingapore_random_discussion_and_small_questions/ialvmdt/
iammaye,v1b0n2,got my daily dose of dopamine,1653972255,t3_v1b0n2,/r/singapore/comments/v1b0n2/rsingapore_random_discussion_and_small_questions/iammaye/
ials7e1,v1b0n2,[se~ no!](https://youtu.be/uKxyLmbOc0Q?t=1),1653955717,t3_v1b0n2,/r/singapore/comments/v1b0n2/rsingapore_random_discussion_and_small_questions/ials7e1/
iaml032,v1b0n2,"10 mins left for lunch break and body decides to play a prank on me by suddenly feeling the urge to shit. Sit down on the throne, custom jam gg. I'm in deep shit",1653971388,t3_v1b0n2,/r/singapore/comments/v1b0n2/rsingapore_random_discussion_and_small_questions/iaml032/
iamur3s,v1b0n2,made instant noodles because i didn’t know what to get for lunch and now i feel bad 🥲,1653978477,t3_v1b0n2,/r/singapore/comments/v1b0n2/rsingapore_random_discussion_and_small_questions/iamur3s/
ian81sg,v1b0n2,Clarke quay donki got space can eat food right?,1653990327,t3_v1b0n2,/r/singapore/comments/v1b0n2/rsingapore_random_discussion_and_small_questions/ian81sg/
ianz6og,v1b0n2,does anyone know if the sunglasses sold at capitol optical in lucky plaza are legit? i saw some really cute ones but i want to make sure theyre real before i buy.,1654006985,t3_v1b0n2,/r/singapore/comments/v1b0n2/rsingapore_random_discussion_and_small_questions/ianz6og/
iam6q7e,v1b0n2,"asking for a friend, where is a good salon for men. Budget <$35",1653963151,t3_v1b0n2,/r/singapore/comments/v1b0n2/rsingapore_random_discussion_and_small_questions/iam6q7e/
iamia5s,v1b0n2,"Just curious, is anyone still driving manual passenger cars in Singapore?",1653969633,t3_v1b0n2,/r/singapore/comments/v1b0n2/rsingapore_random_discussion_and_small_questions/iamia5s/
iamnajs,v1b0n2,anyone has stories of the bali couple's curse,1653972927,t3_v1b0n2,/r/singapore/comments/v1b0n2/rsingapore_random_discussion_and_small_questions/iamnajs/
iam2v8u,v1b0n2,This month need eat less to pay for electricity bill coz air con is all time on 😂,1653961175,t3_v1b0n2,/r/singapore/comments/v1b0n2/rsingapore_random_discussion_and_small_questions/iam2v8u/
iam4ycl,v1b0n2,Where can I find good claypot rice? Is there one in the North-East area?,1653962234,t3_v1b0n2,/r/singapore/comments/v1b0n2/rsingapore_random_discussion_and_small_questions/iam4ycl/
iamco6s,v1b0n2,"Lol dreamed I was doing food delivery, then I absentmindedly drink their drinks, so gotta go mcd buy replacement, on top of being late.",1653966302,t3_v1b0n2,/r/singapore/comments/v1b0n2/rsingapore_random_discussion_and_small_questions/iamco6s/
iamhlw7,v1b0n2,Those large spray bottles for plants feel good on the face. I also have a small 50 ml spray bottle filled with water. It's too dang hot.\n\nWill we see power cuts?,1653969206,t3_v1b0n2,/r/singapore/comments/v1b0n2/rsingapore_random_discussion_and_small_questions/iamhlw7/
iamktf4,v1b0n2,less than 2 months b4  House of the Dragon\n\nany1 giving it a chance?,1653971263,t3_v1b0n2,/r/singapore/comments/v1b0n2/rsingapore_random_discussion_and_small_questions/iamktf4/
iamqk86,v1b0n2,Anyone knows how much is it to increase the size by one chain for formal watch?,1653975234,t3_v1b0n2,/r/singapore/comments/v1b0n2/rsingapore_random_discussion_and_small_questions/iamqk86/
iamup5o,v1b0n2,Any good places to travel solo in Indonesia/Bali?,1653978431,t3_v1b0n2,/r/singapore/comments/v1b0n2/rsingapore_random_discussion_and_small_questions/iamup5o/
ianacwx,v1b0n2,Anyone runs a Fuma 2 in their PC and did a fan swap? I'm considering swapping out the Kaze Flex II fans and replacing them with the fastest Wonder Snails or the Arctic P12s...,1653992327,t3_v1b0n2,/r/singapore/comments/v1b0n2/rsingapore_random_discussion_and_small_questions/ianacwx/
iandql2,v1b0n2,There's an egg yolk leaving the sky,1653994966,t3_v1b0n2,/r/singapore/comments/v1b0n2/rsingapore_random_discussion_and_small_questions/iandql2/
ianllzv,v1b0n2,[deleted],1654000083,t3_v1b0n2,/r/singapore/comments/v1b0n2/rsingapore_random_discussion_and_small_questions/ianllzv/
iaoed7h,v1b0n2,[deleted],1654013593,t3_v1b0n2,/r/singapore/comments/v1b0n2/rsingapore_random_discussion_and_small_questions/iaoed7h/
iaopsx7,v1b0n2,Childhood snacks don’t taste as good as I used to remember. Bought hello panda but didn’t like it as much,1654018393,t3_v1b0n2,/r/singapore/comments/v1b0n2/rsingapore_random_discussion_and_small_questions/iaopsx7/
iaotqxp,v1b0n2,looking for advice! how do y’all go for job interviews when you’re employed and looking to switch job!!,1654020037,t3_v1b0n2,/r/singapore/comments/v1b0n2/rsingapore_random_discussion_and_small_questions/iaotqxp/
iap2s3l,v1b0n2,Not sure why I'm not tired at all,1654023837,t3_v1b0n2,/r/singapore/comments/v1b0n2/rsingapore_random_discussion_and_small_questions/iap2s3l/
iap58b6,v1b0n2,"""彼此情软的时候有说不完的话。。。如今开口。。倒怕会伤着彼此。。。\n\n还是安静些的好""",1654025538,t3_v1b0n2,/r/singapore/comments/v1b0n2/rsingapore_random_discussion_and_small_questions/iap58b6/
iam3425,v1b0n2,is ur energy quiet or loud,1653961295,t3_v1b0n2,/r/singapore/comments/v1b0n2/rsingapore_random_discussion_and_small_questions/iam3425/
iam06av,v1b0n2,Today is the last day to eat fresh chicken from msia,1653959791,t3_v1b0n2,/r/singapore/comments/v1b0n2/rsingapore_random_discussion_and_small_questions/iam06av/
ialqm05,v1b0n2,"Lol at SimplyGo, man. Didn't debit my Google Pay MRT transaction from Sunday until now and then complains that my phone cannot be used for tapping into the bus. Had to dig out my actual card from my wallet.",1653954885,t3_v1b0n2,/r/singapore/comments/v1b0n2/rsingapore_random_discussion_and_small_questions/ialqm05/
iam135s,v1b0n2,trying to find sustainability jobs...,1653960257,t3_v1b0n2,/r/singapore/comments/v1b0n2/rsingapore_random_discussion_and_small_questions/iam135s/
ialpkaf,v1b0n2,TikTok algorithm telling me my rs wont work out hahahaha,1653954330,t3_v1b0n2,/r/singapore/comments/v1b0n2/rsingapore_random_discussion_and_small_questions/ialpkaf/
iam7ngz,v1b0n2,are crypto bros true anarchists?,1653963633,t3_v1b0n2,/r/singapore/comments/v1b0n2/rsingapore_random_discussion_and_small_questions/iam7ngz/
iamrdqd,v1b0n2,who is damaged here,1653975837,t3_v1b0n2,/r/singapore/comments/v1b0n2/rsingapore_random_discussion_and_small_questions/iamrdqd/
iamq5xl,v1b0n2,i am kat,1653974947,t3_v1b0n2,/r/singapore/comments/v1b0n2/rsingapore_random_discussion_and_small_questions/iamq5xl/
iamwtkd,v1b0n2,grumpysenna is mai mama,1653980198,t3_v1b0n2,/r/singapore/comments/v1b0n2/rsingapore_random_discussion_and_small_questions/iamwtkd/
iaof2su,v1b0n2,"I always excel at ruining friendships. In the heat of the moment i accidentally slip out something cruel. I try so hard to fix things but what can you do when the damage is done.\n\nSometimes I wish I never spoke at all, or to never have feelings. Maybe my head wouldnt be this cloudy",1654013895,t3_v1b0n2,/r/singapore/comments/v1b0n2/rsingapore_random_discussion_and_small_questions/iaof2su/
iam4pph,v1b0n2,Anyone knows where you can find accurate piano sheets for free? Those with chords that are suitable for medium / advanced players,1653962110,t3_v1b0n2,/r/singapore/comments/v1b0n2/rsingapore_random_discussion_and_small_questions/iam4pph/
iamg1wy,v1b0n2,[deleted],1653968256,t3_v1b0n2,/r/singapore/comments/v1b0n2/rsingapore_random_discussion_and_small_questions/iamg1wy/
iamvrb7,v1b0n2,"my job agency missed out on 1 day's salary in april, so they paid me back the amount in mid-may. \n\nis my 1 missing day salary also subjected to the cdac deduction?",1653979307,t3_v1b0n2,/r/singapore/comments/v1b0n2/rsingapore_random_discussion_and_small_questions/iamvrb7/
iamw9cm,v1b0n2,Does anyone know where to rent a car for just one day of the weekend ie Saturday? Want to go to malaysia on that day,1653979726,t3_v1b0n2,/r/singapore/comments/v1b0n2/rsingapore_random_discussion_and_small_questions/iamw9cm/
ian3n3e,v1b0n2,[deleted],1653986292,t3_v1b0n2,/r/singapore/comments/v1b0n2/rsingapore_random_discussion_and_small_questions/ian3n3e/
ian6zct,v1b0n2,As a tourist where can I get the cheapest Covid-tests for flying out of SG?,1653989374,t3_v1b0n2,/r/singapore/comments/v1b0n2/rsingapore_random_discussion_and_small_questions/ian6zct/
ianabfo,v1b0n2,Is it possible to apply for a position (through like job portals) under the same company but different department (like hospital or ministries) without an internal transfer?,1653992292,t3_v1b0n2,/r/singapore/comments/v1b0n2/rsingapore_random_discussion_and_small_questions/ianabfo/
iao1vjn,v1b0n2,Until now I have no side effects from my booster shot. Is it because I kena COVID last year that I have the immunity?,1654008199,t3_v1b0n2,/r/singapore/comments/v1b0n2/rsingapore_random_discussion_and_small_questions/iao1vjn/
iao2sye,v1b0n2,[deleted],1654008612,t3_v1b0n2,/r/singapore/comments/v1b0n2/rsingapore_random_discussion_and_small_questions/iao2sye/
iao4m5z,v1b0n2,currently facing a rather serious problem. can anyone give me advice?,1654009407,t3_v1b0n2,/r/singapore/comments/v1b0n2/rsingapore_random_discussion_and_small_questions/iao4m5z/
iao80hm,v1b0n2,Which row would you reccomend to seat in capitol theather - stall section??,1654010880,t3_v1b0n2,/r/singapore/comments/v1b0n2/rsingapore_random_discussion_and_small_questions/iao80hm/
iaod38a,v1b0n2,I’m sitting down. And SWEATINF,1654013042,t3_v1b0n2,/r/singapore/comments/v1b0n2/rsingapore_random_discussion_and_small_questions/iaod38a/
iaoj38o,v1b0n2,"For once, I woke up feeling peaceful today but bit by bit, my peace was stolen.\n\nLandlord asked me when I’m moving out (I was supposed to move out in June but he agreed to just deduct from my deposit in case I overstay), then proceeded to ask me to pay him another month’s rent? When I reminded him he said “You’re sure you won’t be staying till July right?” Knnb. I told him yes and finally he agreed. Then I continued my day searching for properties but had landlords/agents ignoring me left and right. In the end I only managed to find one property to view tmr. Rn still feeling so stressed and am worried I will be rejected since I’m renting short-term and many landlords will prioritise people who are able to rent longer",1654015584,t3_v1b0n2,/r/singapore/comments/v1b0n2/rsingapore_random_discussion_and_small_questions/iaoj38o/
iamn7fj,v1b0n2,No it isn't bad and I'm sure they'd understand. Just say you brought your own lunch or eating something else.,1653972868,t1_iamm4ba,/r/singapore/comments/v1b0n2/rsingapore_random_discussion_and_small_questions/iamn7fj/
iamywcg,v1b0n2,"Just say ""intern pay can't afford, WINK NUDGE HINT HINT CONVERT ME FULL TIME NOTED WITH KTHX""",1653981993,t1_iamm4ba,/r/singapore/comments/v1b0n2/rsingapore_random_discussion_and_small_questions/iamywcg/
iampovw,v1b0n2,"That's the norm. In almost all the companies I've been in, the interns hang out with the other interns and only go for lunch once in a while with the bosses. Sometimes the bosses want to chat abt stuff/gossip which they don't want the interns to hear. \n\nThey also know you can't afford eating where they are all the time (they shd know cos they're paying you and maybe that's why they're choosing it...) if they do ask, then say you would love to join them but you're on a budget. They will understand and will accommodate on days that they want you to come (either by going to cheaper places or by treating you)",1653974601,t1_iamm4ba,/r/singapore/comments/v1b0n2/rsingapore_random_discussion_and_small_questions/iampovw/
iamo506,v1b0n2,"no, don’t need eat with them. the way some of my friends eat is very scary. when holiday mood every single meal they eat can be $20 to $40. they are not rich btw, is parents money",1653973506,t1_iamm4ba,/r/singapore/comments/v1b0n2/rsingapore_random_discussion_and_small_questions/iamo506/
iampnxf,v1b0n2,"Maybe can ask first where they're eating. And if they say xx, reply that it's out your budget:",1653974583,t1_iamm4ba,/r/singapore/comments/v1b0n2/rsingapore_random_discussion_and_small_questions/iampnxf/
iamma0i,v1b0n2,why would it be bad?,1653972238,t1_iamm4ba,/r/singapore/comments/v1b0n2/rsingapore_random_discussion_and_small_questions/iamma0i/
ianamqh,v1b0n2,Tell me about it. I struggle horribly with this. Empathy was identified as my topmost 'talent' in a strengths assessment at work too. And that basement empathy is difficult to handle.,1653992552,t1_ian5smm,/r/singapore/comments/v1b0n2/rsingapore_random_discussion_and_small_questions/ianamqh/
ian8nem,v1b0n2,it's a birb eat birb world,1653990855,t1_ian8dva,/r/singapore/comments/v1b0n2/rsingapore_random_discussion_and_small_questions/ian8nem/
iamewyf,v1b0n2,I don't get innerwears. Why layer yourself with an inner wear to feel cool when u can just wear nothing underneath and achieve similar results?,1653967587,t1_iambtvq,/r/singapore/comments/v1b0n2/rsingapore_random_discussion_and_small_questions/iamewyf/
iamcikh,v1b0n2,Thanks for the info,1653966215,t1_iambtvq,/r/singapore/comments/v1b0n2/rsingapore_random_discussion_and_small_questions/iamcikh/
iamhdue,v1b0n2,Yes I swear by Airism,1653969066,t1_iambtvq,/r/singapore/comments/v1b0n2/rsingapore_random_discussion_and_small_questions/iamhdue/
iamxva6,v1b0n2,His followers are just as creepy,1653981087,t1_iamxk9a,/r/singapore/comments/v1b0n2/rsingapore_random_discussion_and_small_questions/iamxva6/
ian05br,v1b0n2,He got the 老妖精 face.,1653983106,t1_iamxk9a,/r/singapore/comments/v1b0n2/rsingapore_random_discussion_and_small_questions/ian05br/
iamyvqf,v1b0n2,"The vibes man, the vibes.",1653981978,t1_iamxk9a,/r/singapore/comments/v1b0n2/rsingapore_random_discussion_and_small_questions/iamyvqf/
iamybjy,v1b0n2,The self-given name already kinda creeped me out... Prince?,1653981487,t1_iamxk9a,/r/singapore/comments/v1b0n2/rsingapore_random_discussion_and_small_questions/iamybjy/
ian6zab,v1b0n2,Just remember Revenue - Expenses = Profit/Loss,1653989372,t1_ian60ux,/r/singapore/comments/v1b0n2/rsingapore_random_discussion_and_small_questions/ian6zab/
ianabpa,v1b0n2,"If it helps, I majored in accounting & am working as an accountant now.. nothing I learnt in school is applicable to work, except A = L + E lol.",1653992299,t1_ian60ux,/r/singapore/comments/v1b0n2/rsingapore_random_discussion_and_small_questions/ianabpa/
ian98j0,v1b0n2,U can do it!! Take deep breaths and give urself pep talk.,1653991361,t1_ian60ux,/r/singapore/comments/v1b0n2/rsingapore_random_discussion_and_small_questions/ian98j0/
ianhfgi,v1b0n2,Become milk shake instead😀,1653997521,t1_iane5rn,/r/singapore/comments/v1b0n2/rsingapore_random_discussion_and_small_questions/ianhfgi/
iangxzv,v1b0n2,wah shag,1653997205,t1_iane5rn,/r/singapore/comments/v1b0n2/rsingapore_random_discussion_and_small_questions/iangxzv/
iam8eye,v1b0n2,"Take an early L, or throw your R. 😅",1653964029,t1_iam7moi,/r/singapore/comments/v1b0n2/rsingapore_random_discussion_and_small_questions/iam8eye/
iamajvn,v1b0n2,"Now you get the three of them in one room, dim the lights, and put on some soft music",1653965152,t1_iam7moi,/r/singapore/comments/v1b0n2/rsingapore_random_discussion_and_small_questions/iamajvn/
iam9i2w,v1b0n2,"lol! reminds of me of the email auto reply A: ""i am on leave, please check with B"" B: i am on leave, please check with A"".",1653964594,t1_iam7moi,/r/singapore/comments/v1b0n2/rsingapore_random_discussion_and_small_questions/iam9i2w/
iaovbmn,v1b0n2,Great for you!,1654020698,t1_iaotpc5,/r/singapore/comments/v1b0n2/rsingapore_random_discussion_and_small_questions/iaovbmn/
ian11zw,v1b0n2,That sounds very good. Hoping to get the job?,1653983927,t1_ian0b9x,/r/singapore/comments/v1b0n2/rsingapore_random_discussion_and_small_questions/ian11zw/
ian3omw,v1b0n2,Awww that’s great news! I’m happy and excited to see where this brings you. Sure we have to temper our hopes and expectations but a pleasant interview is always appreciated.,1653986331,t1_ian0b9x,/r/singapore/comments/v1b0n2/rsingapore_random_discussion_and_small_questions/ian3omw/
ian0zp4,v1b0n2,Congrats!!! Did she offer you a job on the spot? What industry are you applying for btw?,1653983869,t1_ian0b9x,/r/singapore/comments/v1b0n2/rsingapore_random_discussion_and_small_questions/ian0zp4/
ian5fv8,v1b0n2,Congrats! Great that you could build such a connection during an interview 😀,1653987944,t1_ian0b9x,/r/singapore/comments/v1b0n2/rsingapore_random_discussion_and_small_questions/ian5fv8/
