id,submission_id,body,created_utc,parent_id,permalink
iam6guu,v1fop2,"Your submission was removed from /r/singapore due to being too short. All text submissions must be at least 50 characters long.\n\n\n*I am a bot, and this action was performed automatically. Please [contact the moderators of this subreddit](/message/compose/?to=/r/singapore) if you have any questions or concerns.*",1653963016,t3_v1fop2,/r/singapore/comments/v1fop2/which_lky_book_do_i_read_first_from_third_world/iam6guu/
iam8onf,v1ddv2,Pay rises via job hop of course.,1653964165,t3_v1ddv2,/r/singapore/comments/v1ddv2/robust_pay_rises_in_singapore_last_year_tempered/iam8onf/
ialyk3k,v1ddv2,In other words: marginal real wage growth last year,1653958962,t3_v1ddv2,/r/singapore/comments/v1ddv2/robust_pay_rises_in_singapore_last_year_tempered/ialyk3k/
iam2p4r,v1ddv2,"It is not a socioeconomic ladder anymore, it's a treadmill. You fall off the moment you stop for a second.",1653961086,t3_v1ddv2,/r/singapore/comments/v1ddv2/robust_pay_rises_in_singapore_last_year_tempered/iam2p4r/
iam044m,v1ddv2,You guys have pay rise?,1653959760,t3_v1ddv2,/r/singapore/comments/v1ddv2/robust_pay_rises_in_singapore_last_year_tempered/iam044m/
iametzh,v1ddv2,What robust pay rise?,1653967538,t3_v1ddv2,/r/singapore/comments/v1ddv2/robust_pay_rises_in_singapore_last_year_tempered/iametzh/
iamxrpf,v1ddv2,"Robust inflation in Singapore tempers pay rises from last year.\n\nthe pay rise is when you get back your old pay after 2 years of cuts. ""pay rise""",1653980999,t3_v1ddv2,/r/singapore/comments/v1ddv2/robust_pay_rises_in_singapore_last_year_tempered/iamxrpf/
ianevl7,v1ddv2,If your increment is less than 2.3% it means your purchasing power (real income) has declined…,1653995794,t3_v1ddv2,/r/singapore/comments/v1ddv2/robust_pay_rises_in_singapore_last_year_tempered/ianevl7/
iam8rk2,v1ddv2,"Boss, if ure reading this, when’s my pay rise!",1653964207,t3_v1ddv2,/r/singapore/comments/v1ddv2/robust_pay_rises_in_singapore_last_year_tempered/iam8rk2/
iamgkxn,v1ddv2,Robust pay rise from job hopping lol,1653968576,t3_v1ddv2,/r/singapore/comments/v1ddv2/robust_pay_rises_in_singapore_last_year_tempered/iamgkxn/
ianc8tq,v1ddv2,"Who are getting these ""robust"" pay rises??",1653993843,t3_v1ddv2,/r/singapore/comments/v1ddv2/robust_pay_rises_in_singapore_last_year_tempered/ianc8tq/
ialzld8,v1ddv2,Sorry robust ???\n\nMy increment is literally less than inflation.,1653959492,t3_v1ddv2,/r/singapore/comments/v1ddv2/robust_pay_rises_in_singapore_last_year_tempered/ialzld8/
iama1us,v1ddv2,You guys got pay rise?,1653964886,t3_v1ddv2,/r/singapore/comments/v1ddv2/robust_pay_rises_in_singapore_last_year_tempered/iama1us/
iand3un,v1ddv2,My nominal increment kenna eaten up by inflation and its not even enough to cover,1653994502,t3_v1ddv2,/r/singapore/comments/v1ddv2/robust_pay_rises_in_singapore_last_year_tempered/iand3un/
ialu6t3,v1ddv2,"> # Robust pay rises in Singapore last year tempered by inflation\n\n> SINGAPORE - Most workers saw pay hikes last year, but rising prices meant that their gains were tempered.\n\n> With a large majority of companies raking in profits, 70 per cent of workers saw their pay packets expand, with resident workers who had stayed in their jobs for at least one year taking home an extra 3.9 per cent on average.\n\n> But inflation ate into their gains and their spending power increased by just 1.6 per cent - less than half of their nominal pay hikes.\n\n> Despite nominally bigger pay cheques, workers have fared worse only once over the past five years. That was in 2020, when real wage growth was 1.4 per cent despite prices dipping marginally.\n\n> Some 59 per cent of workers saw their nominal pay increase in 2020. The biggest hikes went to junior executives, who have become the most sought-after segment of the workforce.\n\n> Prospects appeared brighter last year as the economy expanded 7.6 per cent and three in four companies were profitable. But an inflation rate of 2.3 per cent diluted real gains for workers.\n\n> High prices are expected to persist for the rest of the year as lockdowns in China and the Ukraine war worsen supply bottlenecks, said Dr Hong Ru, assistant professor of banking and finance at Nanyang Business School.\n\n> “The key is how fast we can get out of this supply chain issue and to really increase productivity. If we can do this fast, we will be in a good position next year,” he said.\n\n> Inflation is expected to peak at 4 per cent between July and September before easing in late 2022.\n\n> Recruiter Michael Page, which reported that most firms were planning to give annual increments of 3 per cent this year, expects that bigger hikes would be made after September.\n\n> Its managing director, Mr Nilay Khandelwal, said: “This is when we would really know what exactly would be the AI (annual increment) and inflation rates. Generally speaking, Singapore AI is pretty much tied to the inflation rate to a large extent.”\n\n---\n1.0.2 | [Source code](https://github.com/fterh/sneakpeek) | [Contribute](https://github.com/fterh/sneakpeek)",1653956744,t3_v1ddv2,/r/singapore/comments/v1ddv2/robust_pay_rises_in_singapore_last_year_tempered/ialu6t3/
iamk8kd,v1ddv2,Everything up except my pay and portfolio pcbknn,1653970883,t3_v1ddv2,/r/singapore/comments/v1ddv2/robust_pay_rises_in_singapore_last_year_tempered/iamk8kd/
iaolmq3,v1ddv2,Tldr: lan pa pa lan,1654016645,t3_v1ddv2,/r/singapore/comments/v1ddv2/robust_pay_rises_in_singapore_last_year_tempered/iaolmq3/
iam2sm6,v1ddv2,robust wage increases tempered by even more fucking cheebye robust inflation,1653961136,t1_ialyk3k,/r/singapore/comments/v1ddv2/robust_pay_rises_in_singapore_last_year_tempered/iam2sm6/
iam3vpa,v1ddv2,That’s the whole point of capitalism and modern life,1653961683,t1_iam2p4r,/r/singapore/comments/v1ddv2/robust_pay_rises_in_singapore_last_year_tempered/iam3vpa/
ianc8d8,v1ddv2,Tharman says Singapore doesn’t believe in a safety net.,1653993834,t1_iam2p4r,/r/singapore/comments/v1ddv2/robust_pay_rises_in_singapore_last_year_tempered/ianc8d8/
iam61ad,v1ddv2,I wonder as well. What increment? Company made record profits and we got zilch,1653962787,t1_iam044m,/r/singapore/comments/v1ddv2/robust_pay_rises_in_singapore_last_year_tempered/iam61ad/
iamgw4t,v1ddv2,Can't hear you over his new maserati,1653968766,t1_iam8rk2,/r/singapore/comments/v1ddv2/robust_pay_rises_in_singapore_last_year_tempered/iamgw4t/
iamsxlk,v1ddv2,"swap job, + %%",1653977023,t1_iama1us,/r/singapore/comments/v1ddv2/robust_pay_rises_in_singapore_last_year_tempered/iamsxlk/
iamrucp,v1ddv2,you guys got paid?,1653976187,t1_iama1us,/r/singapore/comments/v1ddv2/robust_pay_rises_in_singapore_last_year_tempered/iamrucp/
ian701w,v1ddv2,You are just a Soylent Green in the eyes of capitalism.,1653989392,t1_iam3vpa,/r/singapore/comments/v1ddv2/robust_pay_rises_in_singapore_last_year_tempered/ian701w/
iamlitc,v1ddv2,"To add that, record profit backed by gov sponsored manpower funding.",1653971734,t1_iam61ad,/r/singapore/comments/v1ddv2/robust_pay_rises_in_singapore_last_year_tempered/iamlitc/
iamt1aa,v1ddv2,https://www.businesstimes.com.sg/companies-markets/lian-beng-says-covid-19-government-grants-helped-boost-remuneration-for-key-execs\n\nBecause you not key execs,1653977099,t1_iam61ad,/r/singapore/comments/v1ddv2/robust_pay_rises_in_singapore_last_year_tempered/iamt1aa/
iancc7m,v1ddv2,This is the only way sia.\n\nHR/Management is too dumb re their talent management strategies.,1653993916,t1_iamsxlk,/r/singapore/comments/v1ddv2/robust_pay_rises_in_singapore_last_year_tempered/iancc7m/
iancaf7,v1ddv2,Hello MOM.,1653993878,t1_iamrucp,/r/singapore/comments/v1ddv2/robust_pay_rises_in_singapore_last_year_tempered/iancaf7/
iallz14,v1ccrr,"Headline click baity. He meant stupid if dont make use of govt grant, not that phe thinks prices are dirt cheap. Saved you a click.",1653952463,t3_v1ccrr,/r/singapore/comments/v1ccrr/stupid_if_dont_buy_hugo_ng_pays_700k_in_1_shot/iallz14/
ialycvd,v1ccrr,"For those wondering, a similar [article](https://www.8days.sg/entertainment/asian/hugo-ng-son-hdb-flat-700k-full-641976) by 8days reported that he has since sold off all his overseas properties and is currently renting a place in Penang.",1653958861,t3_v1ccrr,/r/singapore/comments/v1ccrr/stupid_if_dont_buy_hugo_ng_pays_700k_in_1_shot/ialycvd/
iamd39p,v1ccrr,Still can’t beat this guy. \n\nhttps://sg.finance.yahoo.com/news/villa-sky-marina-bay-residences-010000828.html?guccounter=1\n\nBuying a penthouse in his 1 year old son’s name.,1653966533,t3_v1ccrr,/r/singapore/comments/v1ccrr/stupid_if_dont_buy_hugo_ng_pays_700k_in_1_shot/iamd39p/
ialphex,v1ccrr,meanwhile single males can't buy hdb till 35 even tho they served NS...\n\ncause screw their underproductive dicks,1653954289,t3_v1ccrr,/r/singapore/comments/v1ccrr/stupid_if_dont_buy_hugo_ng_pays_700k_in_1_shot/ialphex/
iamnbpj,v1ccrr,"Man this guy, i was surprised to find out that he was a singaporean actor like zhu mimi..i watched a hk drama called ""Brother's Keeper "" and he was such a great villain in that show. He was such an Ahole in that show that i almost felt like punching him tbh lol.",1653972949,t3_v1ccrr,/r/singapore/comments/v1ccrr/stupid_if_dont_buy_hugo_ng_pays_700k_in_1_shot/iamnbpj/
ialqqkr,v1ccrr,I am more curious whose name the HDB is under. Can't be his son only right.,1653954952,t3_v1ccrr,/r/singapore/comments/v1ccrr/stupid_if_dont_buy_hugo_ng_pays_700k_in_1_shot/ialqqkr/
ialld4v,v1ccrr,"looks like those 1980s built 5-room Executive Apartment. guy is hk actor but think also on local shows, cant be sure dont watch mediacorpse",1653952147,t3_v1ccrr,/r/singapore/comments/v1ccrr/stupid_if_dont_buy_hugo_ng_pays_700k_in_1_shot/ialld4v/
ialx9sq,v1ccrr,"Means- testing nope, GST voucher for Sentosa folks way to go!",1653958305,t3_v1ccrr,/r/singapore/comments/v1ccrr/stupid_if_dont_buy_hugo_ng_pays_700k_in_1_shot/ialx9sq/
ialrp5l,v1ccrr,[deleted],1653955453,t3_v1ccrr,/r/singapore/comments/v1ccrr/stupid_if_dont_buy_hugo_ng_pays_700k_in_1_shot/ialrp5l/
ialxx58,v1ccrr,"i haven't read any comments but i am already feeling the saltiness from the title...\n\nkeep'em coming, people! The fries i am having is tasteless",1653958641,t3_v1ccrr,/r/singapore/comments/v1ccrr/stupid_if_dont_buy_hugo_ng_pays_700k_in_1_shot/ialxx58/
ialluvl,v1ccrr,Typical boomer attitude towards HDB. Why is this news?,1653952405,t3_v1ccrr,/r/singapore/comments/v1ccrr/stupid_if_dont_buy_hugo_ng_pays_700k_in_1_shot/ialluvl/
iamdbr6,v1ccrr,"I feel the word ""buy"" should not be used to describe paying 99 years rent up front.",1653966669,t3_v1ccrr,/r/singapore/comments/v1ccrr/stupid_if_dont_buy_hugo_ng_pays_700k_in_1_shot/iamdbr6/
ialtmi8,v1ccrr,Know what’s dumb? Paying the full sum for the flat upfront,1653956454,t3_v1ccrr,/r/singapore/comments/v1ccrr/stupid_if_dont_buy_hugo_ng_pays_700k_in_1_shot/ialtmi8/
iam9c04,v1ccrr,"Thank you for your service, I hate clickbaiters",1653964505,t1_iallz14,/r/singapore/comments/v1ccrr/stupid_if_dont_buy_hugo_ng_pays_700k_in_1_shot/iam9c04/
ialmb8o,v1ccrr,Stupid if you think people on reddit click into the article and read it.,1653952643,t1_iallz14,/r/singapore/comments/v1ccrr/stupid_if_dont_buy_hugo_ng_pays_700k_in_1_shot/ialmb8o/
iamqvp4,v1ccrr,"Depends man 700k may be a good price depending on what he bought. Where the location is and size, anyone know?",1653975467,t1_iallz14,/r/singapore/comments/v1ccrr/stupid_if_dont_buy_hugo_ng_pays_700k_in_1_shot/iamqvp4/
iamof4z,v1ccrr,Doing gods work,1653973704,t1_iallz14,/r/singapore/comments/v1ccrr/stupid_if_dont_buy_hugo_ng_pays_700k_in_1_shot/iamof4z/
iam4foz,v1ccrr,[https://www.todayonline.com/8days/sceneandheard/entertainment/hugo-ngs-reported-s864mil-worth-property-said-all-be-under-his](https://www.todayonline.com/8days/sceneandheard/entertainment/hugo-ngs-reported-s864mil-worth-property-said-all-be-under-his)\n\nThis one is more relevant. The guy has a lot of property in HK but it's all under his wife's name. So he should be eligible to buy HDB here.,1653961966,t1_ialycvd,/r/singapore/comments/v1ccrr/stupid_if_dont_buy_hugo_ng_pays_700k_in_1_shot/iam4foz/
ian2l1y,v1ccrr,Loophole closed liao.,1653985328,t1_iamd39p,/r/singapore/comments/v1ccrr/stupid_if_dont_buy_hugo_ng_pays_700k_in_1_shot/ian2l1y/
iam5wv4,v1ccrr,"Two years of living in close quarters with other topless guys in their physical prime, a few of those NS boys are bound to turn to the other side and reject traditional marriage/family. NS is counterproductive and is turning our fellas gay! Govt should do something about it",1653962725,t1_ialphex,/r/singapore/comments/v1ccrr/stupid_if_dont_buy_hugo_ng_pays_700k_in_1_shot/iam5wv4/
ialtvgx,v1ccrr,"Haha ""cause screw their underproductive dicks"", yea wondering why can't buy with friend or something",1653956580,t1_ialphex,/r/singapore/comments/v1ccrr/stupid_if_dont_buy_hugo_ng_pays_700k_in_1_shot/ialtvgx/
iam7onr,v1ccrr,Have you ever wondered?\n\nWhy must we se-erve?\n\nBecause enlistment act and they catch you go DB go DB… YAH!,1653963651,t1_ialphex,/r/singapore/comments/v1ccrr/stupid_if_dont_buy_hugo_ng_pays_700k_in_1_shot/iam7onr/
iamnev1,v1ccrr,you dont need a productive dick to get married before you can purchase your own flats.,1653973010,t1_ialphex,/r/singapore/comments/v1ccrr/stupid_if_dont_buy_hugo_ng_pays_700k_in_1_shot/iamnev1/
iama3ja,v1ccrr,Served NS doesn't mean MR yet,1653964910,t1_ialphex,/r/singapore/comments/v1ccrr/stupid_if_dont_buy_hugo_ng_pays_700k_in_1_shot/iama3ja/
iam3tkn,v1ccrr,"Why not his own name (plus wife)? He could have sold off whatever property he had in HK and used the proceeds to buy this HDB. I'm not sure why this is even a news article, other than him being a minor celebrity.\n\nETA: [https://www.todayonline.com/8days/sceneandheard/entertainment/hugo-ngs-reported-s864mil-worth-property-said-all-be-under-his](https://www.todayonline.com/8days/sceneandheard/entertainment/hugo-ngs-reported-s864mil-worth-property-said-all-be-under-his)\n\nHe purportedly owns a lot of property but it's all in his wife's name. So I guess the HDB can be under his name.",1653961652,t1_ialqqkr,/r/singapore/comments/v1ccrr/stupid_if_dont_buy_hugo_ng_pays_700k_in_1_shot/iam3tkn/
iaqq51p,v1ccrr,Parent plus adult child counts as a family unit.,1654051927,t1_ialqqkr,/r/singapore/comments/v1ccrr/stupid_if_dont_buy_hugo_ng_pays_700k_in_1_shot/iaqq51p/
ialpp7p,v1ccrr,He is Singaporean who started from SBC then when to HK.,1653954402,t1_ialld4v,/r/singapore/comments/v1ccrr/stupid_if_dont_buy_hugo_ng_pays_700k_in_1_shot/ialpp7p/
ialy0vg,v1ccrr,i see another that didn't **read**,1653958695,t1_ialrp5l,/r/singapore/comments/v1ccrr/stupid_if_dont_buy_hugo_ng_pays_700k_in_1_shot/ialy0vg/
iam2a7n,v1ccrr,Might want to test for Covid sir,1653960875,t1_ialxx58,/r/singapore/comments/v1ccrr/stupid_if_dont_buy_hugo_ng_pays_700k_in_1_shot/iam2a7n/
iampwmk,v1ccrr,"The only people who think that are either below 16 or above 60. Nobody ever complains about 99 year leasehold condos, only HDBs for some reason.",1653974758,t1_iamdbr6,/r/singapore/comments/v1ccrr/stupid_if_dont_buy_hugo_ng_pays_700k_in_1_shot/iampwmk/
ialy54v,v1ccrr,know what's even dumber? Thinking that 700k is an amount that matters to him.,1653958755,t1_ialtmi8,/r/singapore/comments/v1ccrr/stupid_if_dont_buy_hugo_ng_pays_700k_in_1_shot/ialy54v/
ialyd53,v1ccrr,Exactly. Also the interest is super low now. \n\nSome people believe that paying upfront like this they save the lifetime interest paid. That could be about 100k sgd additional. \n\n\nI think that guy father could have help him pay 700k as down payment for a condo. Probably a cheap orchard 2 room,1653958865,t1_ialtmi8,/r/singapore/comments/v1ccrr/stupid_if_dont_buy_hugo_ng_pays_700k_in_1_shot/ialyd53/
iam9sbl,v1ccrr,Later they just create mixed units with guys and girls,1653964748,t1_iam5wv4,/r/singapore/comments/v1ccrr/stupid_if_dont_buy_hugo_ng_pays_700k_in_1_shot/iam9sbl/
iamj8h1,v1ccrr,>turning our fellas gay! Govt should do something about it\n\nJust remember to say no homo,1653970235,t1_iam5wv4,/r/singapore/comments/v1ccrr/stupid_if_dont_buy_hugo_ng_pays_700k_in_1_shot/iamj8h1/
iandk5x,v1ccrr,Time to introduce mixed NS! \nA buddy system that involves male-female instead of male-male,1653994836,t1_iam5wv4,/r/singapore/comments/v1ccrr/stupid_if_dont_buy_hugo_ng_pays_700k_in_1_shot/iandk5x/
iamnigm,v1ccrr,"Ns did the opposite for me, it turned me more heterosexual instead of homo after seeing so many men for 2 years..",1653973079,t1_iam5wv4,/r/singapore/comments/v1ccrr/stupid_if_dont_buy_hugo_ng_pays_700k_in_1_shot/iamnigm/
iamymj9,v1ccrr,Based Greco-Roman pilled,1653981748,t1_iam5wv4,/r/singapore/comments/v1ccrr/stupid_if_dont_buy_hugo_ng_pays_700k_in_1_shot/iamymj9/
iamloh1,v1ccrr,"Government sponsored titty strip clubs, then.",1653971839,t1_iam5wv4,/r/singapore/comments/v1ccrr/stupid_if_dont_buy_hugo_ng_pays_700k_in_1_shot/iamloh1/
ialzv0y,v1ccrr,Because govnt pushing for family of one man and one woman. Anything outside of that scope can go eat shit.,1653959630,t1_ialtvgx,/r/singapore/comments/v1ccrr/stupid_if_dont_buy_hugo_ng_pays_700k_in_1_shot/ialzv0y/
ialxcyt,v1ccrr,Hdb as a form subsidized housing is mainly to help family creation. \n\n1) why taxpayers need to subsidize your flat if you buying with your friend ?\n\n2) why need to own house if you just planning to stay with friend .can also rent since\n\n3)if you want to buy house as an investment property then invest in the open market(condo),1653958350,t1_ialtvgx,/r/singapore/comments/v1ccrr/stupid_if_dont_buy_hugo_ng_pays_700k_in_1_shot/ialxcyt/
iam2yff,v1ccrr,it's KFC fries. it's shitty and tasteless by default and i need all the salt i can get.,1653961218,t1_iam2a7n,/r/singapore/comments/v1ccrr/stupid_if_dont_buy_hugo_ng_pays_700k_in_1_shot/iam2yff/
iam46dz,v1ccrr,He is semi-retired and 62 years old. How to get a loan?,1653961834,t1_ialyd53,/r/singapore/comments/v1ccrr/stupid_if_dont_buy_hugo_ng_pays_700k_in_1_shot/iam46dz/
iama8ld,v1ccrr,Increase birth rate is what they want but forgot also create broken families,1653964985,t1_iam9sbl,/r/singapore/comments/v1ccrr/stupid_if_dont_buy_hugo_ng_pays_700k_in_1_shot/iama8ld/
iamnkgq,v1ccrr,then it'd be worse than the hostels in local unis..,1653973119,t1_iam9sbl,/r/singapore/comments/v1ccrr/stupid_if_dont_buy_hugo_ng_pays_700k_in_1_shot/iamnkgq/
iamnob6,v1ccrr,Get to work and start producing babies then!,1653973194,t1_iamnigm,/r/singapore/comments/v1ccrr/stupid_if_dont_buy_hugo_ng_pays_700k_in_1_shot/iamnob6/
iam89ho,v1ccrr,"Yeah, apparently two gay men doesn't make a family. We don't even mind adopting a kid to start our family but gov says no. Hahah",1653963952,t1_ialzv0y,/r/singapore/comments/v1ccrr/stupid_if_dont_buy_hugo_ng_pays_700k_in_1_shot/iam89ho/
iam5pvc,v1ccrr,"Sounds reasonable, im not supportive or LGBT its a plus. Buying with a friend can remove the pressure of not finding a Soulmate to finally own a house  but yea i would rather tax money be used to help subsidize a family then a group of friends",1653962627,t1_ialzv0y,/r/singapore/comments/v1ccrr/stupid_if_dont_buy_hugo_ng_pays_700k_in_1_shot/iam5pvc/
iam0b2g,v1ccrr,>Hdb as a form subsidized housing is mainly to help family creation. \n>\n>1) why taxpayers need to subsidize your flat if you buying with your friend ?\n>\n>2) why need to own house if you just planning to stay with friend .can also rent since\n\nThose are stupid arguments. \n\nWhy should taxpayers help subsidize your flat just because you want to pop out kids? \n\nWhy need to own house just because you want to have kids? Can also rent what.,1653959859,t1_ialxcyt,/r/singapore/comments/v1ccrr/stupid_if_dont_buy_hugo_ng_pays_700k_in_1_shot/iam0b2g/
ialzzv3,v1ccrr,I guess there’s an expectation that people shouldn’t be treated like cattle and have our ability to have a kid affect our ability to get our own roof over our heads.,1653959698,t1_ialxcyt,/r/singapore/comments/v1ccrr/stupid_if_dont_buy_hugo_ng_pays_700k_in_1_shot/ialzzv3/
iam9n5z,v1ccrr,"Hmm,OK. So my life long partner who happens to be the same gender is a friend.. guess those who are straight and infertile or do nor wish to have kids are just two friends living together.",1653964670,t1_ialxcyt,/r/singapore/comments/v1ccrr/stupid_if_dont_buy_hugo_ng_pays_700k_in_1_shot/iam9n5z/
iamzer0,v1ccrr,"> Hdb as a form subsidized housing is mainly to help family creation. \n\nSo couples who don't make babies in x years should have the subsidies clawed back, right?",1653982445,t1_ialxcyt,/r/singapore/comments/v1ccrr/stupid_if_dont_buy_hugo_ng_pays_700k_in_1_shot/iamzer0/
iam328z,v1ccrr,Are millionaires in some special exclusive club with access to KFC fries? They're only selling wedges now.,1653961270,t1_iam2yff,/r/singapore/comments/v1ccrr/stupid_if_dont_buy_hugo_ng_pays_700k_in_1_shot/iam328z/
iam9d2a,v1ccrr,KFC now wedges no more fries.,1653964519,t1_iam2yff,/r/singapore/comments/v1ccrr/stupid_if_dont_buy_hugo_ng_pays_700k_in_1_shot/iam9d2a/
iammvnq,v1ccrr,He’s worth hundreds of million. Getting a asset based loan is easy. Assuming he desire 1.,1653972644,t1_iam46dz,/r/singapore/comments/v1ccrr/stupid_if_dont_buy_hugo_ng_pays_700k_in_1_shot/iammvnq/
iam9432,v1ccrr,"It's not totally impossible. There's those loans where the bank takes the (high) interest payment from you, with the agreement that the house goes back to the bank when you die. But ofc there's a lot of conditions and rules to this type of loan, to ensure the bank makes money at the end of the day.",1653964389,t1_iam46dz,/r/singapore/comments/v1ccrr/stupid_if_dont_buy_hugo_ng_pays_700k_in_1_shot/iam9432/
ian2zan,v1ccrr,Gov: Broken or not family is family... Muh TFR,1653985692,t1_iama8ld,/r/singapore/comments/v1ccrr/stupid_if_dont_buy_hugo_ng_pays_700k_in_1_shot/ian2zan/
iamtkte,v1ccrr,In us their recruits all stay tgt,1653977527,t1_iamnkgq,/r/singapore/comments/v1ccrr/stupid_if_dont_buy_hugo_ng_pays_700k_in_1_shot/iamtkte/
iam934g,v1ccrr,"Because gays and lesbians are *obviously* bad ppl, like pedos and drug users. Can't encourage something like that here.",1653964375,t1_iam89ho,/r/singapore/comments/v1ccrr/stupid_if_dont_buy_hugo_ng_pays_700k_in_1_shot/iam934g/
iama4v0,v1ccrr,"But two gay men obviously can’t have their own children. Imagine how much of the gay agenda they would inculcate into them? Worst still, they would obviously diddle with any sons they would have…. \n\n/s/s/s\n\nMight be /s on my part, but there’s definitely people who thinks this way.",1653964931,t1_iam89ho,/r/singapore/comments/v1ccrr/stupid_if_dont_buy_hugo_ng_pays_700k_in_1_shot/iama4v0/
iam7g41,v1ccrr,"Based on your logic, why are we subsidising childfree couples",1653963527,t1_iam5pvc,/r/singapore/comments/v1ccrr/stupid_if_dont_buy_hugo_ng_pays_700k_in_1_shot/iam7g41/
iam583d,v1ccrr,Thanks for ripping his argument a new hole. I was having a slight stroke when reading those stupid arguments...why even live when you're gonna die anyway hah.,1653962375,t1_iam0b2g,/r/singapore/comments/v1ccrr/stupid_if_dont_buy_hugo_ng_pays_700k_in_1_shot/iam583d/
iam1w0d,v1ccrr,PAP IB copy and pasting responses,1653960672,t1_iam0b2g,/r/singapore/comments/v1ccrr/stupid_if_dont_buy_hugo_ng_pays_700k_in_1_shot/iam1w0d/
iam4wxz,v1ccrr,"> Why should taxpayers help subsidize your flat just because you want to pop out kids?\n\nBecause one of biggest reasons why people don’t want to have kids is because of costs, especially housing costs. Singapore’s birth rate is falling. \n\nSo if there is a way to make it easier for parents to have kids, it should be done, and one way to do that would be through subsidies. \n\nTo be fair it is an imperfect way to subsidize costs given the rise of DINKs.",1653962214,t1_iam0b2g,/r/singapore/comments/v1ccrr/stupid_if_dont_buy_hugo_ng_pays_700k_in_1_shot/iam4wxz/
iam4b52,v1ccrr,"This is pap's policy platform and a majority of singapore citizens agreed with pap's allocation of 'subsidies' to 'family unit'. So while you may perceive it as 'stupid', this policy has been approved by the citizens.\n\nSo why should tax payer help subsidise the flat for people who wishes to 'pop out kids'? Because the citizens agreed to the 'subsidies'.\n\nPlease note there is no actual subsidies, but 'discount' off 'market price'.",1653961901,t1_iam0b2g,/r/singapore/comments/v1ccrr/stupid_if_dont_buy_hugo_ng_pays_700k_in_1_shot/iam4b52/
iam23b9,v1ccrr,"If you look across the world ,’home ownership’ is not a basic survival need. So if you want a roof over your head, it’s a luxury. great life-goal and ambition. Work for it and earn it. A private property will cost around 600k. \n\nIf not you can rent and go to the social services unit if you are too poor. They will house you somewhere.",1653960778,t1_ialzzv3,/r/singapore/comments/v1ccrr/stupid_if_dont_buy_hugo_ng_pays_700k_in_1_shot/iam23b9/
iamaofl,v1ccrr,"Shitty tasteless wedges, might I add.",1653965219,t1_iam328z,/r/singapore/comments/v1ccrr/stupid_if_dont_buy_hugo_ng_pays_700k_in_1_shot/iamaofl/
iam3dz2,v1ccrr,>Are millionaires in some special exclusive club with access to KFC fries\n\nof course there are....served personally by Colonel Sanders' clones,1653961430,t1_iam328z,/r/singapore/comments/v1ccrr/stupid_if_dont_buy_hugo_ng_pays_700k_in_1_shot/iam3dz2/
iam9dd1,v1ccrr,Ya lo. Gay and lesbian people supposedly love handcuffs mah🤪,1653964524,t1_iam934g,/r/singapore/comments/v1ccrr/stupid_if_dont_buy_hugo_ng_pays_700k_in_1_shot/iam9dd1/
iam7ja4,v1ccrr,Ouh right that is a flaw good point,1653963573,t1_iam7g41,/r/singapore/comments/v1ccrr/stupid_if_dont_buy_hugo_ng_pays_700k_in_1_shot/iam7ja4/
iami7eg,v1ccrr,"Good point, if couple remain childless after mop, they should be forced sell.",1653969587,t1_iam7g41,/r/singapore/comments/v1ccrr/stupid_if_dont_buy_hugo_ng_pays_700k_in_1_shot/iami7eg/
