id,submission_id,body,created_utc,parent_id,permalink
iamvomz,v1b0n2,"> When I'm new at the workplace: boss, lay down the law for me.\n> \n> When I'm lao jiao: I am the law.\n\nVery true. \n\nNew to workplace: MUST ATTEND EVERY MEETING! \n\nLao jiao: Eh, important director not attending ah? No need show face then. What's the agenda, not involving me I'll pass thanks.",1653979246,t1_iamopxe,/r/singapore/comments/v1b0n2/rsingapore_random_discussion_and_small_questions/iamvomz/
iamqqks,v1b0n2,Yes agree. I’ve just started a new role but somehow I don’t feel that there’s a concrete expectations/ norms of working. Not very familiar with the scope and processes in detail also. I’m feeling quite uncomfortable if this even makes sense. Don’t really want to bother my boss since he looks quite swarmed but at the same time not sure what I can do or help with. Like everyone has their stuff to talk about during standups but I’m just there twiddling my thumbs,1653975362,t1_iamopxe,/r/singapore/comments/v1b0n2/rsingapore_random_discussion_and_small_questions/iamqqks/
iamry0e,v1b0n2,Boss’s desk,1653976262,t1_iamrszc,/r/singapore/comments/v1b0n2/rsingapore_random_discussion_and_small_questions/iamry0e/
iamxiiz,v1b0n2,Paris baguette choco cake!,1653980777,t1_iamxcwn,/r/singapore/comments/v1b0n2/rsingapore_random_discussion_and_small_questions/iamxiiz/
iaqt4cg,v1b0n2,I have recs. Will send them to you tonight hahaha,1654053473,t1_ianqhwv,/r/singapore/comments/v1b0n2/rsingapore_random_discussion_and_small_questions/iaqt4cg/
ian6z50,v1b0n2,MMM,1653989369,t1_ian6oop,/r/singapore/comments/v1b0n2/rsingapore_random_discussion_and_small_questions/ian6z50/
ianrcdh,v1b0n2,It was only for a short while 🥲,1654003205,t1_iano7sq,/r/singapore/comments/v1b0n2/rsingapore_random_discussion_and_small_questions/ianrcdh/
ianrgrf,v1b0n2,It didn’t last long 🥲,1654003266,t1_ianox3g,/r/singapore/comments/v1b0n2/rsingapore_random_discussion_and_small_questions/ianrgrf/
iansaog,v1b0n2,I'm not sure if I'm that confident to run topless haha,1654003685,t1_ianpl75,/r/singapore/comments/v1b0n2/rsingapore_random_discussion_and_small_questions/iansaog/
ians6vc,v1b0n2,"Exactly, it's like I'm the only one with a faucet over my head",1654003631,t1_ianqp46,/r/singapore/comments/v1b0n2/rsingapore_random_discussion_and_small_questions/ians6vc/
ianxoql,v1b0n2,I sit still also sweat a lot recently,1654006289,t1_ianu38l,/r/singapore/comments/v1b0n2/rsingapore_random_discussion_and_small_questions/ianxoql/
ianxkif,v1b0n2,You Sibeh steady!! 👍🏻👍🏻,1654006234,t1_ianvci4,/r/singapore/comments/v1b0n2/rsingapore_random_discussion_and_small_questions/ianxkif/
ianzcc7,v1b0n2,Steady boh? Im gg to cancel liao. If u really cfm then I don't  cancel,1654007059,t1_ianvci4,/r/singapore/comments/v1b0n2/rsingapore_random_discussion_and_small_questions/ianzcc7/
ianzdeo,v1b0n2,8 to 10,1654007073,t1_ianvci4,/r/singapore/comments/v1b0n2/rsingapore_random_discussion_and_small_questions/ianzdeo/
iamal08,v1b0n2,Thank uuuuu very fun so far,1653965168,t1_ialvhya,/r/singapore/comments/v1b0n2/rsingapore_random_discussion_and_small_questions/iamal08/
iamnhq8,v1b0n2,Cos he only got his holiday leave approved last friday or so. And he didn’t thought of his passport expiring until earlier today..,1653973065,t1_iamn4ec,/r/singapore/comments/v1b0n2/rsingapore_random_discussion_and_small_questions/iamnhq8/
iamnjl4,v1b0n2,Huh what’s that?,1653973102,t1_iamnhbs,/r/singapore/comments/v1b0n2/rsingapore_random_discussion_and_small_questions/iamnjl4/
ianblxa,v1b0n2,"You can start small first, then slowly build up.",1653993345,t1_ianaeff,/r/singapore/comments/v1b0n2/rsingapore_random_discussion_and_small_questions/ianblxa/
ianbl4l,v1b0n2,"Per month, not per day. \n\nPer day, I can do 11km to 14km only.",1653993327,t1_ianan1t,/r/singapore/comments/v1b0n2/rsingapore_random_discussion_and_small_questions/ianbl4l/
iang8bk,v1b0n2,"312 to 30 days means one day I need to run 10.4km, which should be attainable if I continue to have the same willpower and determination. \n\nBut I am considering to start strength training this month as well, so let us see how it goes.",1653996728,t1_iance9z,/r/singapore/comments/v1b0n2/rsingapore_random_discussion_and_small_questions/iang8bk/
iannv8h,v1b0n2,Cosplay as Hideyoshi Kinoshita,1654001355,t1_ianm23y,/r/singapore/comments/v1b0n2/rsingapore_random_discussion_and_small_questions/iannv8h/
ianwr58,v1b0n2,sango koko sango koko sango koko,1654005850,t1_ianidqo,/r/singapore/comments/v1b0n2/rsingapore_random_discussion_and_small_questions/ianwr58/
ialtef3,v1b0n2,Yeah but it still feels kinda bad because the other staff are getting kinda overworked if I have to hand over my stuff to them to handle also,1653956341,t1_ialr420,/r/singapore/comments/v1b0n2/rsingapore_random_discussion_and_small_questions/ialtef3/
ianc546,v1b0n2,Yes by foot masseur! My thighs and calves have multiple bruises,1653993764,t1_ian95qu,/r/singapore/comments/v1b0n2/rsingapore_random_discussion_and_small_questions/ianc546/
iao3kk3,v1b0n2,"Yeah… sigh so many things can be checked through the already extensive knowledge base but no, they’d rather wait",1654008953,t1_ianesb4,/r/singapore/comments/v1b0n2/rsingapore_random_discussion_and_small_questions/iao3kk3/
ianqsa3,v1b0n2,boost like became not so nice recently liao leh,1654002918,t1_iang8x2,/r/singapore/comments/v1b0n2/rsingapore_random_discussion_and_small_questions/ianqsa3/
iaob38e,v1b0n2,True,1654012195,t1_iao65s9,/r/singapore/comments/v1b0n2/rsingapore_random_discussion_and_small_questions/iaob38e/
ian7682,v1b0n2,"Mai bluff ppl, the only book u read is lao fu zi",1653989548,t1_ian6w5i,/r/singapore/comments/v1b0n2/rsingapore_random_discussion_and_small_questions/ian7682/
ian7xk8,v1b0n2,🤣🤣🤣 have a good day too lolz,1653990220,t1_ian6w5i,/r/singapore/comments/v1b0n2/rsingapore_random_discussion_and_small_questions/ian7xk8/
ian9atz,v1b0n2,tks queen,1653991414,t1_ian8u7a,/r/singapore/comments/v1b0n2/rsingapore_random_discussion_and_small_questions/ian9atz/
ianttbv,v1b0n2,Moi bbfa,1654004443,t1_ianthq4,/r/singapore/comments/v1b0n2/rsingapore_random_discussion_and_small_questions/ianttbv/
iampnc1,v1b0n2,**HMM**,1653974570,t1_iamctwn,/r/singapore/comments/v1b0n2/rsingapore_random_discussion_and_small_questions/iampnc1/
iame2yw,v1b0n2,Lol! I suppose I could have opted out of the dramatic all caps 😂,1653967102,t1_iamctwn,/r/singapore/comments/v1b0n2/rsingapore_random_discussion_and_small_questions/iame2yw/
iame4hz,v1b0n2,"Not really, it's just a way to earn while I wait :(",1653967127,t1_iamdxt6,/r/singapore/comments/v1b0n2/rsingapore_random_discussion_and_small_questions/iame4hz/
iangmjr,v1b0n2,You’re right 👍,1653996993,t1_iangcu4,/r/singapore/comments/v1b0n2/rsingapore_random_discussion_and_small_questions/iangmjr/
iang69n,v1b0n2,I hope so too :’),1653996690,t1_ianfirj,/r/singapore/comments/v1b0n2/rsingapore_random_discussion_and_small_questions/iang69n/
ianvf2c,v1b0n2, cannot my acc is precious,1654005215,t1_iannvtn,/r/singapore/comments/v1b0n2/rsingapore_random_discussion_and_small_questions/ianvf2c/
ianvoy4,v1b0n2,"I usually decline.\n\nA few years ago, I accepted a few headhunters connection, hoping to get more job offers.  \n\nWhat happened was my Linkedin was swamped with connection notifications.  Every time somebody connects with the headhunter, I get a notification.  Things got old real fast.",1654005346,t1_ianv68u,/r/singapore/comments/v1b0n2/rsingapore_random_discussion_and_small_questions/ianvoy4/
iambr58,v1b0n2,https://www.straitstimes.com/singapore/free-hpv-jab-for-women-with-blue-or-orange-chas-cards-in-fight-against-cervical-cancer,1653965797,t1_iamagnn,/r/singapore/comments/v1b0n2/rsingapore_random_discussion_and_small_questions/iambr58/
iamcyin,v1b0n2,"Sorry i can't tell what other vaccines i going to take haha.\n\n\nYes i had upside down side effects from c19 vaccine, but luckily nothing bad for the booster.\n\n\nYou very strong leh, did you get any side effects from any c19 shot?",1653966460,t1_iamagnn,/r/singapore/comments/v1b0n2/rsingapore_random_discussion_and_small_questions/iamcyin/
iamkgxh,v1b0n2,Hallo uncle only watch hololive de hokay,1653971032,t1_iamke1z,/r/singapore/comments/v1b0n2/rsingapore_random_discussion_and_small_questions/iamkgxh/
iamrvvw,v1b0n2,"AH, it's horus rising (Warhammer) - thanks for the prompt (Yep, it's a book)",1653976220,t1_iamp289,/r/singapore/comments/v1b0n2/rsingapore_random_discussion_and_small_questions/iamrvvw/
ian5yn8,v1b0n2,"here hdb carpark, don't seem like got cctv. waste 58$ fixing lol.\n\nparents dont want make police report also, say waste time",1653988428,t1_ian5fyx,/r/singapore/comments/v1b0n2/rsingapore_random_discussion_and_small_questions/ian5yn8/
iaodjy2,v1b0n2,"I wish I could go Taiwan, didn’t pick Bintan because I prefer travel further from Singapore.",1654013241,t1_iany09r,/r/singapore/comments/v1b0n2/rsingapore_random_discussion_and_small_questions/iaodjy2/
ianksrm,v1b0n2,Yea I think Melbourne is more expensive although Phuket could be hotter too.,1653999611,t1_ianjtol,/r/singapore/comments/v1b0n2/rsingapore_random_discussion_and_small_questions/ianksrm/
iangi63,v1b0n2,I have been bangkok twice previously so thinking of going others places where I have not been before.,1653996912,t1_iangcqc,/r/singapore/comments/v1b0n2/rsingapore_random_discussion_and_small_questions/iangi63/
ianh3g2,v1b0n2,"I am thinking of relaxing in different beaches, then maybe take a boat to travel to different island for scenery, or any mode of transportation to travel around and explore new places. Shopping won’t be my priority for this trip.",1653997303,t1_iangtcz,/r/singapore/comments/v1b0n2/rsingapore_random_discussion_and_small_questions/ianh3g2/
ianekd3,v1b0n2,i can’t find from app thou haha,1653995570,t1_ianehy5,/r/singapore/comments/v1b0n2/rsingapore_random_discussion_and_small_questions/ianekd3/
ianqxrr,v1b0n2,Am sad. :(,1654002998,t1_ianp1y2,/r/singapore/comments/v1b0n2/rsingapore_random_discussion_and_small_questions/ianqxrr/
iao1d7r,v1b0n2,Thank you!,1654007976,t1_iao17zh,/r/singapore/comments/v1b0n2/rsingapore_random_discussion_and_small_questions/iao1d7r/
iao1h7i,v1b0n2,Is the spelling correct for that? 😂,1654008025,t1_iao17zh,/r/singapore/comments/v1b0n2/rsingapore_random_discussion_and_small_questions/iao1h7i/
iao2pg2,v1b0n2,Thank you,1654008570,t1_iao1mff,/r/singapore/comments/v1b0n2/rsingapore_random_discussion_and_small_questions/iao2pg2/
iao2byp,v1b0n2,poor ah tan..,1654008404,t1_iao1mff,/r/singapore/comments/v1b0n2/rsingapore_random_discussion_and_small_questions/iao2byp/
iao4cef,v1b0n2,Ohh and what about those tele consult services like speed doc? I saw they had something like that. Those won't be recorded in the system?,1654009290,t1_iao39sp,/r/singapore/comments/v1b0n2/rsingapore_random_discussion_and_small_questions/iao4cef/
iaoa6n4,v1b0n2,Not true (unless things changed in the last month or two). You can do a supervised test on camera. I did it with Dr Anywhere.\n\nIs it useful? Honestly I don't know for what at this point,1654011811,t1_iao39sp,/r/singapore/comments/v1b0n2/rsingapore_random_discussion_and_small_questions/iaoa6n4/
ialx47m,v1b0n2,"now, now\n\nim busy wif filling up my tummy with crap\n\nno need to b impatiant",1653958227,t1_ialwtmy,/r/singapore/comments/v1b0n2/rsingapore_random_discussion_and_small_questions/ialx47m/
ian72kx,v1b0n2,thank you :’) hopefully can burn it off tomorrow on a long walk,1653989456,t1_ian3bz5,/r/singapore/comments/v1b0n2/rsingapore_random_discussion_and_small_questions/ian72kx/
ian85dk,v1b0n2,Thanks,1653990414,t1_ian84p1,/r/singapore/comments/v1b0n2/rsingapore_random_discussion_and_small_questions/ian85dk/
iamkmpq,v1b0n2,Does it save petrol?,1653971141,t1_iamjk3i,/r/singapore/comments/v1b0n2/rsingapore_random_discussion_and_small_questions/iamkmpq/
iam408b,v1b0n2,Used to have nose allergy when air con is on. But since i use air purifier seems better,1653961747,t1_iam3igu,/r/singapore/comments/v1b0n2/rsingapore_random_discussion_and_small_questions/iam408b/
iamcqfo,v1b0n2,I find the bee Hoon really good there lol,1653966336,t1_iam8jo3,/r/singapore/comments/v1b0n2/rsingapore_random_discussion_and_small_questions/iamcqfo/
ian7rbq,v1b0n2,"It’s not very nice, I think normal food court ones are nicer. But yes it’s for a good cause so I’m not there expecting high standards.",1653990067,t1_iam7z7g,/r/singapore/comments/v1b0n2/rsingapore_random_discussion_and_small_questions/ian7rbq/
iamk8yo,v1b0n2,I wonder if this is a dream scene of/for a food delivery person which somehow mistakenly got taken up by by dream cinema. 😅,1653970890,t1_iamfkpw,/r/singapore/comments/v1b0n2/rsingapore_random_discussion_and_small_questions/iamk8yo/
iamta3w,v1b0n2,Yea I do but Im not sure if that's possible. It was given to me by someone else. I don't hold any kind of papers. It's a seiko watch. Do they do it for free even though I don't have any authentication,1653977287,t1_iamqmh8,/r/singapore/comments/v1b0n2/rsingapore_random_discussion_and_small_questions/iamta3w/
iaof3t1,v1b0n2,Ran away,1654013906,t1_iaoeorv,/r/singapore/comments/v1b0n2/rsingapore_random_discussion_and_small_questions/iaof3t1/
iamfr2m,v1b0n2,the problem comes when the industry claims something is decentralized when it's not,1653968077,t1_iamal6u,/r/singapore/comments/v1b0n2/rsingapore_random_discussion_and_small_questions/iamfr2m/
iamsgx6,v1b0n2,kat,1653976665,t1_iamr7eu,/r/singapore/comments/v1b0n2/rsingapore_random_discussion_and_small_questions/iamsgx6/
iam6lu4,v1b0n2,All my classical homies should know imslp,1653963087,t1_iam5mxk,/r/singapore/comments/v1b0n2/rsingapore_random_discussion_and_small_questions/iam6lu4/
iamapfn,v1b0n2,Thank you! I’m more looking for pop/ modern tho.,1653965234,t1_iam5mxk,/r/singapore/comments/v1b0n2/rsingapore_random_discussion_and_small_questions/iamapfn/
iaman07,v1b0n2,Thank you!,1653965197,t1_iam9nja,/r/singapore/comments/v1b0n2/rsingapore_random_discussion_and_small_questions/iaman07/
iamz0pq,v1b0n2,"i am! thanks for your reply, i settled the issue alr 😊",1653982100,t1_iamycqp,/r/singapore/comments/v1b0n2/rsingapore_random_discussion_and_small_questions/iamz0pq/
ianabvc,v1b0n2,Ya lor. Have to look at carousell. But just tried asking reddit,1653992303,t1_iamy2gt,/r/singapore/comments/v1b0n2/rsingapore_random_discussion_and_small_questions/ianabvc/
iamyxnc,v1b0n2,1K fine leh if bring attempt to bring to malaysia haha,1653982024,t1_iamwnz6,/r/singapore/comments/v1b0n2/rsingapore_random_discussion_and_small_questions/iamyxnc/
iamxbj0,v1b0n2,Getgo can rent into Msia?,1653980614,t1_iamwnz6,/r/singapore/comments/v1b0n2/rsingapore_random_discussion_and_small_questions/iamxbj0/
iamxz9s,v1b0n2,Getgo cannot bring into Malaysia.,1653981185,t1_iamwnz6,/r/singapore/comments/v1b0n2/rsingapore_random_discussion_and_small_questions/iamxz9s/
iao4cx0,v1b0n2,Yes exactly,1654009296,t1_ian71ij,/r/singapore/comments/v1b0n2/rsingapore_random_discussion_and_small_questions/iao4cx0/
iamoymd,v1b0n2,do you really want to work with people who would get offended by this,1653974083,t1_iamnglo,/r/singapore/comments/v1b0n2/rsingapore_random_discussion_and_small_questions/iamoymd/
iamqv7o,v1b0n2,maybe they don't want you around too? just kidding. go make friends with the other interns.,1653975457,t1_iamnglo,/r/singapore/comments/v1b0n2/rsingapore_random_discussion_and_small_questions/iamqv7o/
iamwds2,v1b0n2,"That's true too. I've had interns under me and while they were alright to work with, I wanted a break from my erm\n.. ""babysitting duties"". Can't discuss sensitive stuff when the interns are around, esp if my colleagues were from another department. \n\nAnd sometimes you just want to eat somewhere nice with the colleagues you're on friendlier terms with.",1653979829,t1_iamula0,/r/singapore/comments/v1b0n2/rsingapore_random_discussion_and_small_questions/iamwds2/
iammlix,v1b0n2,"impressions can be cleared up with this magical thing called the mouth. be upfront. say it unabashedly ""LAO NIANG NO MONEY EVERY DAY EAT GOOD FOOD""",1653972454,t1_iammf5d,/r/singapore/comments/v1b0n2/rsingapore_random_discussion_and_small_questions/iammlix/
ian04cy,v1b0n2,that's one unique name,1653983083,t1_iamzm77,/r/singapore/comments/v1b0n2/rsingapore_random_discussion_and_small_questions/ian04cy/
ian8ssj,v1b0n2,Just remember to bring your calculator,1653990986,t1_ian728h,/r/singapore/comments/v1b0n2/rsingapore_random_discussion_and_small_questions/ian8ssj/
iamk009,v1b0n2,I'm curious. How much will you be earning in your first year in workforce? Why is it only enough to barely cover food and transport? Surely you can't be having a take home pay of less than 1k.,1653970732,t1_iamhoe5,/r/singapore/comments/v1b0n2/rsingapore_random_discussion_and_small_questions/iamk009/
ianxzil,v1b0n2,Hmmmmm if you're on TFL (interest starts only after grad) doesn't it make more sense to put your cash into singapore savings bond or some other investment where you have guaranteed returns and withdraw just before graduation & pay your fees?,1654006428,t1_iamhoe5,/r/singapore/comments/v1b0n2/rsingapore_random_discussion_and_small_questions/ianxzil/
iamjxmy,v1b0n2,No bowling alley?! What kinda shit company is this?!,1653970691,t1_iamj5zh,/r/singapore/comments/v1b0n2/rsingapore_random_discussion_and_small_questions/iamjxmy/
ian4pgs,v1b0n2,Oh teens and children are brutal… you got consider talking to a therapist?,1653987269,t1_ian4dyk,/r/singapore/comments/v1b0n2/rsingapore_random_discussion_and_small_questions/ian4pgs/
ian60y3,v1b0n2,I’m so sorry to hear that. Reach out if you ever need a listening ear!,1653988489,t1_ian4c8z,/r/singapore/comments/v1b0n2/rsingapore_random_discussion_and_small_questions/ian60y3/
ian4ud4,v1b0n2,It does feel good to receive a person’s love. Hopefully you can find that soon enough. Take care,1653987396,t1_ian4fbe,/r/singapore/comments/v1b0n2/rsingapore_random_discussion_and_small_questions/ian4ud4/
iana456,v1b0n2,idk lol,1653992118,t1_ian9lkl,/r/singapore/comments/v1b0n2/rsingapore_random_discussion_and_small_questions/iana456/
ian5u4n,v1b0n2,D:,1653988309,t1_ian3poz,/r/singapore/comments/v1b0n2/rsingapore_random_discussion_and_small_questions/ian5u4n/
ian3ekw,v1b0n2,"Aiyah, that one family drama… haha",1653986079,t1_iamzpy9,/r/singapore/comments/v1b0n2/rsingapore_random_discussion_and_small_questions/ian3ekw/
ian415e,v1b0n2,"We need: LKY Day, Raffles Day, Sang Nila Utama Day",1653986649,t1_ian2i7k,/r/singapore/comments/v1b0n2/rsingapore_random_discussion_and_small_questions/ian415e/
ian4e31,v1b0n2,"> 'celebrate our Founders' Day',\n\n*Excited ACS noises*",1653986979,t1_ian2i7k,/r/singapore/comments/v1b0n2/rsingapore_random_discussion_and_small_questions/ian4e31/
ian8hae,v1b0n2,naise hope the trip went well,1653990707,t1_ian8fu3,/r/singapore/comments/v1b0n2/rsingapore_random_discussion_and_small_questions/ian8hae/
ian1c80,v1b0n2,Haha thanks for the offer but I doubt I'll be able to find time to be honest. But just curious also how is it like cuz my only impression of onsen is a steam room full of tattooed Japanese yakuza LOL.,1653984186,t1_ian0udg,/r/singapore/comments/v1b0n2/rsingapore_random_discussion_and_small_questions/ian1c80/
ian66dk,v1b0n2,can reply to my dm first? haha,1653988631,t1_ian0hwa,/r/singapore/comments/v1b0n2/rsingapore_random_discussion_and_small_questions/ian66dk/
ian82fr,v1b0n2,i think ending in breakup and death are a bit different. but to go all in is an act of faith,1653990344,t1_ian6rr1,/r/singapore/comments/v1b0n2/rsingapore_random_discussion_and_small_questions/ian82fr/
ian5jtw,v1b0n2,Don’t go into a rs seeing the end….,1653988042,t1_ian59vq,/r/singapore/comments/v1b0n2/rsingapore_random_discussion_and_small_questions/ian5jtw/
ianz82z,v1b0n2,but why would u start a RS with someone when you think the rs will end? that excludes death btw,1654007003,t1_ianqwrs,/r/singapore/comments/v1b0n2/rsingapore_random_discussion_and_small_questions/ianz82z/
iangnw7,v1b0n2,"To each his own I guess. I personally see relationships as high risk gambling, and I hate gambling",1653997019,t1_iane0vz,/r/singapore/comments/v1b0n2/rsingapore_random_discussion_and_small_questions/iangnw7/
ian8ext,v1b0n2,Buy a hope!,1653990647,t1_ian62jm,/r/singapore/comments/v1b0n2/rsingapore_random_discussion_and_small_questions/ian8ext/
ianaxhu,v1b0n2,Any prospects of getting promoted for wearing four hats?,1653992803,t1_ianapc4,/r/singapore/comments/v1b0n2/rsingapore_random_discussion_and_small_questions/ianaxhu/
iaqu0a3,v1b0n2,I just do a simple stretch up and start running.,1654053947,t1_ianzl9x,/r/singapore/comments/v1b0n2/rsingapore_random_discussion_and_small_questions/iaqu0a3/
ianldxi,v1b0n2,Means you had a good time bah,1653999952,t1_iankscf,/r/singapore/comments/v1b0n2/rsingapore_random_discussion_and_small_questions/ianldxi/
ianirzt,v1b0n2,Perfect for cow!,1653998387,t1_ianijfi,/r/singapore/comments/v1b0n2/rsingapore_random_discussion_and_small_questions/ianirzt/
ianswut,v1b0n2,paging u/blackwoodsix,1654003996,t1_iansup9,/r/singapore/comments/v1b0n2/rsingapore_random_discussion_and_small_questions/ianswut/
ian3qku,v1b0n2,Extra chill to the bone too. Got free company also,1653986382,t1_ian3mxb,/r/singapore/comments/v1b0n2/rsingapore_random_discussion_and_small_questions/ian3qku/
ianbkpe,v1b0n2,Maybe they are too hot,1653993318,t1_ian4kfb,/r/singapore/comments/v1b0n2/rsingapore_random_discussion_and_small_questions/ianbkpe/
ianddz8,v1b0n2,I was shopping at Parkway just now.,1653994708,t1_iand0ln,/r/singapore/comments/v1b0n2/rsingapore_random_discussion_and_small_questions/ianddz8/
iamcdl9,v1b0n2,"Yeah, I can imagine, interaction with family can be stressful and frustrating. The feeling of having your own space is amazing man. Like easier to breathe!",1653966139,t1_iamc4jn,/r/singapore/comments/v1b0n2/rsingapore_random_discussion_and_small_questions/iamcdl9/
iam0d6a,v1b0n2,Bbq wholesale has been around since forever they may have catered to The Last Supper.\n\nThey're reputable don't worry,1653959889,t1_ialtwij,/r/singapore/comments/v1b0n2/rsingapore_random_discussion_and_small_questions/iam0d6a/
ialzymp,v1b0n2," was acceptable i guess, no complaints. only thing was the dessert was kinda gross since by the time u have it was lukewarm already",1653959680,t1_ialtwij,/r/singapore/comments/v1b0n2/rsingapore_random_discussion_and_small_questions/ialzymp/
iam020r,v1b0n2,No harm keeping an eye out for other jobs then. Something else better comes along... then leave. =),1653959729,t1_ialzi81,/r/singapore/comments/v1b0n2/rsingapore_random_discussion_and_small_questions/iam020r/
iam191t,v1b0n2,"if you are the only one in the department, doesnt that make you the highest lackey too?",1653960344,t1_ialzi81,/r/singapore/comments/v1b0n2/rsingapore_random_discussion_and_small_questions/iam191t/
iamacwz,v1b0n2,"Find something else, doesn't seem like much opportunity for learning if you don't even have anyone to learn from",1653965048,t1_ialzi81,/r/singapore/comments/v1b0n2/rsingapore_random_discussion_and_small_questions/iamacwz/
ian5od6,v1b0n2,I once pulled my back because I bent down to pick up my kids’ mattress too quickly. Took me a good three days to recover. And during the time I was moving extra slowly… \n\nOld alr… haha,1653988160,t1_ian5gee,/r/singapore/comments/v1b0n2/rsingapore_random_discussion_and_small_questions/ian5od6/
ianh06v,v1b0n2,"Yes, but only when I'm indoors",1653997244,t1_iangapt,/r/singapore/comments/v1b0n2/rsingapore_random_discussion_and_small_questions/ianh06v/
iam25q1,v1b0n2,Oh I meant don't include it in your resume. Like if you spent 4 months of the year in job A and 8 months of the year in job B... I would just put job B down on the resume and leave job A out.,1653960812,t1_iam1ft3,/r/singapore/comments/v1b0n2/rsingapore_random_discussion_and_small_questions/iam25q1/
iamcqkq,v1b0n2,Shell company for North Korean smuggling,1653966338,t1_iamcnff,/r/singapore/comments/v1b0n2/rsingapore_random_discussion_and_small_questions/iamcqkq/
ian7ado,v1b0n2,"It’s not too bad. IMHO, the whole screen swapping is the killer feature and it boosted the productivity so much than windows system if you have many windows opening.",1653989652,t1_ian70g5,/r/singapore/comments/v1b0n2/rsingapore_random_discussion_and_small_questions/ian7ado/
ianchpd,v1b0n2,Second this. I have one and it lasted me 4.5 years before it went kaput,1653994034,t1_ian70g5,/r/singapore/comments/v1b0n2/rsingapore_random_discussion_and_small_questions/ianchpd/
iamid65,v1b0n2,小明在家里睡懒觉,1653969683,t1_iamhtr5,/r/singapore/comments/v1b0n2/rsingapore_random_discussion_and_small_questions/iamid65/
iantnuh,v1b0n2,This one not just ginnas have lo,1654004369,t1_ianrhyc,/r/singapore/comments/v1b0n2/rsingapore_random_discussion_and_small_questions/iantnuh/
ians36c,v1b0n2,I like to watch people gek sai,1654003578,t1_ianrhyc,/r/singapore/comments/v1b0n2/rsingapore_random_discussion_and_small_questions/ians36c/
iansuyb,v1b0n2,pes is see hensem or not one meh,1654003970,t1_ianrjh6,/r/singapore/comments/v1b0n2/rsingapore_random_discussion_and_small_questions/iansuyb/
ianx1ze,v1b0n2,Don't understand juseyo,1654005991,t1_ianqvjt,/r/singapore/comments/v1b0n2/rsingapore_random_discussion_and_small_questions/ianx1ze/
ianuvyc,v1b0n2,limpeh ish smrt ceo mai siao siao,1654004961,t1_ianu362,/r/singapore/comments/v1b0n2/rsingapore_random_discussion_and_small_questions/ianuvyc/
iamyuep,v1b0n2,"durian, rainy, hot, extra hot, haze?",1653981944,t1_iamyqks,/r/singapore/comments/v1b0n2/rsingapore_random_discussion_and_small_questions/iamyuep/
ianqosi,v1b0n2,Or taken >!for a ride!<,1654002867,t1_ianmqzu,/r/singapore/comments/v1b0n2/rsingapore_random_discussion_and_small_questions/ianqosi/
