id,created_utc,title,selftext,full_link
v0yoce,1653912133,SIA to reopen Changi Airport lounges after completion of $50m upgrade,,https://www.reddit.com/r/singapore/comments/v0yoce/sia_to_reopen_changi_airport_lounges_after/
v0yimw,1653911589,New ability tests expand pool of NSFs eligible for certain SAF roles,,https://www.reddit.com/r/singapore/comments/v0yimw/new_ability_tests_expand_pool_of_nsfs_eligible/
v0ygxb,1653911415,It's getting hot in here: Singaporeans sweating on how to beat the heat,,https://www.reddit.com/r/singapore/comments/v0ygxb/its_getting_hot_in_here_singaporeans_sweating_on/
v0yf7v,1653911239,% of SG HDBs without AC?,"I've been seeing a lot of ""weather too hot, no ac"" replies on r/sg lately, wonder how many people are like me who don't have AC as well.\n\nI know some families absolutely refuse to install AC because they think it will blow up the utilities bill.\n\nSwear I'm not some air-con salesman pulling a 300 IQ move lol",https://www.reddit.com/r/singapore/comments/v0yf7v/of_sg_hdbs_without_ac/
v0ycbf,1653910933,Groomsman guilty of sexually assaulting bride on wedding night,,https://www.reddit.com/r/singapore/comments/v0ycbf/groomsman_guilty_of_sexually_assaulting_bride_on/
v0y3zk,1653910051,is Singapore post actually slow?,"To get to the point, i order alot of stuff online and if Singapore post is used as a carrier just to send it to my country it usually talks a long amount of time just for it to leave the ""post office"". \n\nIs it this slow for the people in Singapore or is it just international?\n\nAsking to see if i should avoid shipping through it even if it's cheaper.",https://www.reddit.com/r/singapore/comments/v0y3zk/is_singapore_post_actually_slow/
v0xwii,1653909244,Is the weather enough to drive you away from here?,[removed],https://www.reddit.com/r/singapore/comments/v0xwii/is_the_weather_enough_to_drive_you_away_from_here/
v0xwc8,1653909222,Weird cloud at Yew Tee,[Weird cloud at Yew Tee? ](https://i.imgur.com/fL04qJF.jpg)\n\nAnyone else see this? It looked so out of place in the sky,https://www.reddit.com/r/singapore/comments/v0xwc8/weird_cloud_at_yew_tee/
v0xmof,1653908221,Interested in signing on,[removed],https://www.reddit.com/r/singapore/comments/v0xmof/interested_in_signing_on/
v0xins,1653907753,Who’s To Blame For Singapore’s Lacklustre Media Scene?,,https://www.reddit.com/r/singapore/comments/v0xins/whos_to_blame_for_singapores_lacklustre_media/
v0xg75,1653907475,Food Crisis and Protectionism-Boom for the Cold Storage Industry,[removed],https://www.reddit.com/r/singapore/comments/v0xg75/food_crisis_and_protectionismboom_for_the_cold/
v0xa4r,1653906756,"Electric atmosphere at Our Tampines Hub as over 3,000 gather to watch Champions League final",,https://www.reddit.com/r/singapore/comments/v0xa4r/electric_atmosphere_at_our_tampines_hub_as_over/
v0x6qo,1653906370,"S'pore feels like 41°C at around 3pm on May 30, 2022",,https://www.reddit.com/r/singapore/comments/v0x6qo/spore_feels_like_41c_at_around_3pm_on_may_30_2022/
v0x46x,1653906062,Singapore Police RC Truck 4WD 1/10 Scale HoBao DC1 Offroad Police Vehicle RC Crawler Extreme,,https://www.reddit.com/r/singapore/comments/v0x46x/singapore_police_rc_truck_4wd_110_scale_hobao_dc1/
v0x3vk,1653906028,"Unveiled: Singapore Airlines’ new First Class Lounge &amp; The Private Room, Changi T3",,https://www.reddit.com/r/singapore/comments/v0x3vk/unveiled_singapore_airlines_new_first_class/
v0wzdk,1653905503,"Online Reasoning Test : Part Of Aptitude Test, Analytical Skill, IQ Test",,https://www.reddit.com/r/singapore/comments/v0wzdk/online_reasoning_test_part_of_aptitude_test/
v0wu23,1653904906,[REQUEST]Look out for wallet at Yishun MRT Station,"Hi. Today I left my wallet at Yishun MRT and found out at Woodlands MRT that I lost my wallet. My wallet has the Tottenham Hotspur logo , is blue-black in colour and has a yellow stripe. The Wallet contains coins adding up to 50¢ and a Blue Student EZ-Link card. I have already contacted Woodlands and Yishun MRT Station and the SMRT hotline. If you have found my wallet, please contact me at 81636684. Thanks A lot .",https://www.reddit.com/r/singapore/comments/v0wu23/requestlook_out_for_wallet_at_yishun_mrt_station/
v0wok7,1653904273,Probation for teen who harassed train passengers by pretending to detonate bomb,,https://www.reddit.com/r/singapore/comments/v0wok7/probation_for_teen_who_harassed_train_passengers/
v0wgmo,1653903287,Buy Google 5 Star Reviews - Google genuine Safe &amp; Guaranteed,,https://www.reddit.com/r/singapore/comments/v0wgmo/buy_google_5_star_reviews_google_genuine_safe/
v0w8aw,1653902273,What is this tiny protected place building near mTower for? It looks too small to be used for anything important.,,https://www.reddit.com/r/singapore/comments/v0w8aw/what_is_this_tiny_protected_place_building_near/
